have, friends, without, clothes
provided, table, upon, which
took, talisman, on, brow
understand, Briggs,,
let, you,,
said, Herr,,
sustaining, life, in, morning
convince, assemblage of persons, In, him
holds, fish, To, starving
speak, language, to, me
entered, studio, behind, her
search, shores between Fanar, by, catches
learnt, alphabet,,
liberty, which,,
told, him,,
had, wisdom, For, one
desired, son, into, earthquake
burst, bounds, upon, you
carried, book, in, pocket
said, it, on, earth
asserted, itself,,
make, memory, for, oblivion
Take, fish, until, morrow
played, game,,
make out, that,,
winding up, system of machinery, to, commencement of game
picked up, glass, on, stool
love, Briggs,,
restrain, outburst of derision,,
discovered, fruit of birth, in, heaven
purified, statue of goddess, before, it
made, change in health, in, weeks
tell, him,,
surnamed, whom, of, manner of life of Morven
receiving, filenames, as, eBooks
taking, place of fear, After, moments of terror
lost, stomach, to, skeleton
regard, you, as, deficient
repeated, Mr., in, temple of Isis at Memphis
forgetting, crocodile, in, excitement
commanded, me, by, company of priests
consider, swimming, of, one
exciting, idea of mechanism, to, operations of Automaton
see, her, at, her
has, facility, at, site
breathed, breath,,
through, What,,
observed, it,,
squeedge, him, to, nothing
advise, ye, of, danger
commanding, master, with, himself
let, them,,
bring forth, young,,
become, maiden, than, man
includes, information about -tm, to, newsletter
invented, machine,,
secured, kid, to, horror
think, ye,,
flung up, hands, in, gesture of despair
say, nothing about it,,
eliminates, thoughts of self, within, you
mean, what, on, principle
say, that, for, all
seeking, sea, from, hills
attended, her, beyond, measure
saw, burden, by, regret
worth, millions,,
represent, it, as, machine
say, what,,
laid, snares for life, amongst, you
gnaw, repose, for, present
download, any of eBooks, by, year
begged, honour, on, knees
heard, tap, to, joy
watching, him, in, swing
shouted, father,,
made, questions about country,,
knew, them,,
impressing, spectators, with, idea
exciting, disbelief, On, hand
thought, Coppertop,,
given, thought,,
embrace, you, at, spot
Name, them, by, torches
given away, myself, for, nought
examining, it,,
rule, world, of, world
do, what,,
had, relative, to, secrecy
represent, thing, in, words
devote, life, to, board of table
added, itself, to, moon
asked, me, against, me
waving, hand, In, house
asked, master, at, price
see, it,,
take, sword,,
heard, nothing, Of, Amenartas
demanded, pieces of gold, with, me
heard, nothing, Of, Kallikrates
Let, me,,
contradicted, Tubuto,,
leaving, Wayne, In, meditation
holds, candle, at, door
had, weakness,,
leave, message, of, moment
desire, race ofpigeonsof shape, from, year to year
hugged, himself, in, tree
bring, myself,,
picking, these,,
chirped, Bird,,
got, consent, to, petition
dragged, lion, along, path
locating, eBooks,,
slay, prophet, at, hour
stirred, soul,,
bidding farewell, me, in, service
attract, monkeys,,
Trust, us,,
observed, coldness, of, apartment
aroused, suspicion, in, us
tell, majesty, by, chance
lift up, spirit, from, beginning
handed, fan, to, Ten-teh
explained, Bird,,
Attend, me,,
practised, that, for, centuries
’ve, brothers, of, you
experienced, sensation,,
spoken, son of herdsman,,
trust, you,,
hear, thee, for, sins
explained, meaning of characters, With, this
found, spirits, under, protection of empress
touched, own, in, days
shrieked, Bird, at, her
refuse, part in race, With, promise
Done, what,,
clashed, arms,,
overhanging, palisade, From, tree
learned, phrases, in, style
have, clothes,,
giving, allowance for defectiveness, at, wit in animal
attending, play, for, instance
remembered, them, of, fires of folly
cried, Coppertop,,
approaching, condition of affluence, to, penury
induced, feeling of contempt, in, Tarzan
pursued, man,,
remember, house,,
took up, word,,
have, leave,,
ravaged, villages,,
observing, shape, at, view
overcome, recollection, in, teeth of prepossession
took, me,,
found, sums of money, in, parts of house
hated, Morven, because, power with people
conquer, him, for, shame
taking, part, In, meanwhile
has, deal of wit, on, feet
agreed, Coppertop, in, tone
Summon, Darvan, to, us
knew, meaning of love,,
holding, man, for, accommodation of man
snarled, other,,
wield, sword, with, Kallikrates
observed, shape, as, any in dominions
outpaced, youths, In, strength
remember, stories,,
shape, it, at, least
prove, which, by, calculation
heard, voice,,
Drop, it,,
gave, him, by, means
satisfy, himself, at, it
watched, her, by, little
aroused, which, in, those
known, it, to, heredity
examine, it, by, those
asked, Bird,,
feasted, you, in, honor of lady
uttered, that, through, cloud
given, all, in, return for nothing
wanted, house, between, you
had, while, with, nicety
help, it,,
had, eyes in Egypt, At, length
told, me, by, bear
have, comfort of 166, than, water
preserving, life, according, laws of nature
impress, company, to, design on part
demand, proof, than, this
took up, abode, with, pomp
viewed, which, by, teeth
Say, it, in, voice
heard, them, on, war-steeds of wave
reached, standard,,
thwart, blacks, In, mind
chirping, loudest, after, animals
Watch, me,,
wiz, What, to, flatterer at side
have, victim,,
said, what,,
watching, proceeding, beneath, him
dried, eyes,,
planning, feast in celebration, until, evening
allow, me, in, kingdom
watching, moon, at, last
shouted, Siror, above, heads of crowd
disdaining, evasion of causes, After, debate
doing, hustling,,
asked, rowers, with, volunteer
corrected, Bird, by, interruption
uttered, yell, at, danger of seer
applied, process, to, purposes
came, tear, for, excess of happiness
receive, bounty, of, rice
decked, walls, within, courts
have, grace,,
doing, What on earth,,
heard, word, After, conclusion
've, face with yez, in, world
selectingwalking, -sticks, by, themselves
give, powder,,
protect, us, to, tasks
waging, wars, in, graces of Court
lost, semblance of meaning, upon, her
had, conception of fears, to, hysteria
applied, myself, to, king
have, him, with, effort
put, it, in, tube
perish, enemies of Morven,,
imagine, this, at, once
had, understanding, for, farmer
swallow up, her, on, brink of gulf
’ve, idea,,
prove, it,,
examined, him, with, me
left, me, in, chair of state
take, beast, off, hands
see, difference, by, time
echoed, cry,,
call, it,,
waving, sword, above, head
killed, him,,
kissed, her,,
stay, hand, From, time
announcing, approach, in, midst of band
cast, network, from, Sz-chuen
gave, which, to, you
took, chair,,
preclude, latter, for, circumstance
be, it,,
protected, me,,
commanded, cabinet-maker, for, bedchamber
subjected, them, to, failure
carried, restraint, upon, people
unshipped, oars, with, which
lifted up, me, for, King of kings
finished, chamber of square with windows, according, direction
have, what,,
answered, Morven,,
relinquished, hand, to, order
gave, signs, of, plans
detecting, breathings of man, in, contact with box
resumed, feeding, for, moment
have, qualities,,
give, life,,
made, ceiling, by, hinges
withdrew, hide, from, village
smite, blasphemer,,
make, proclamation, to, Princess
beg, favour, about, feet
see, one but you,,
make, chairs with backs of substance, for, curiosities
recognized, him, into, chocolate
build, house of gold,,
prevent, accident, on, sides
Tell, her,,
disclosing, interior of machine, from, theroutinewhich
wert, bird,,
drawing, purse, from, bosom
desired, lock for door,,
find, sisters,,
inherit, glory, For, example
open, drawer, For, example
put, them, in, wager
opens, compartment,,
Speak, one,,
surrounded, Hoang, Throughout, period
made, shift, in, pocket of own
pour, acid, into, wound
recovered, poise, over, hummock
came, knocking upon wall, at, hour
see, her,,
ordered, silks, than, blanket
replied, sister,,
studying, what, to, -day
resembling, Persian,,
mean, what, by, limited
seeing, waves, over, valley
leave, that, to, me
shook, purse, on, shore
stood, women, To, beating of tom-toms
send, parcel,,
had, table, upon, same
destroy, house, In, spite of indications
suggested, search for spoor, for, hunt
placed, thyself, like, worm
afford, view of board, in, room
stake, purse,,
sweep, shadow of memory, from, heart
produces, -spores, by, conjugation of hyphæ
had, set of dishes, in, proportion to those
comfort, her, in, vain
consumed, her, with, eyes
concern, itself, With, what
overspread, part of city, among, hollows of vale
has, disadvantages,,
removed, piece of skin,,
dug, it,,
cast, whom, into, teeth
put, purse, by, names in Greek
brought, designs, upon, body
recognized, sister,,
swinging, mittens, for, snow-going
Allow, us, to, Princess
saves, you, from, consequences of indiscretion
throw, arms, towards, her
make, members,,
won back, Egypt, in, days of Aahmes
bought, some, into, myhat
think, What, of, me
struck, scent,,
Had, some of stuff, in, hattoday
sought, evasion, Upon, assurance
vexing, you,,
leaving, thing, on, point
throw open, door, among, mountains
telling, them, toward, circle of warriors about him
playing, tattoo, to, him
ascertaining, breast of figure, against, which
follow, it, to, detail
saw, oo, in, voice
wore, sandal, through, doorway
taken, rise, in, stand
name, another save Morven, on, day
grasp, spears, to, feet
carried, me, of, curiosity
dropping, hand,,
assembling, people, into, cave
utilize, currents of character, in, course of experiments
clutched, him, for, moment
amuses, me, toward, valley
remembered, all, from, arms
took, children from famous, unto, him
prostrated, himself, by, this
know, much, As, matter of fact
served, Aahmes, In, fact
took, pleasure, with, me
made, reflections upon all,,
professed, atotalignorance of game,,
make, words, with, difficulty
put away, crown, upon, him
bring, one,,
watched, husband, in, admiration
done, it,,
attends, him, than, that
seized, me, of, blood
thrown away, state of Widyádharí, for, thing as thee
left, it, among, dancers
elect, king, in, banquet-halls
kissing, us,,
engage, creatures, to, minister
say, it, to, shame
adjusted, skin, Behind, cage
has, stoop in shoulders,,
making, believe, with, embarrassment
answered, foreman,,
encircles, earth, like, currents
appals, cabman, in, languages
drew, auguries, from, entrails of victim
provided, ornaments for hands,,
play, chess,,
sacrificed, host of suitors, for, glance of eye
make, running, As, intelligence
taught, people, by, wisdom
saying, things, to, straps of skis
Waking, Hoang, about, head
get, time, from, me
spread, themselves, over, empire
snuggled, them, under, chin
have, origin in force, for, lack of name
worked, themselves, to, pitch of excitement
resent, injuries, upon, thoughts
waste, time, upon, tale of warrior
Make, most, of, sweetness
spoken, truth, for, himself
closed, which, for, while
cried, voice,,
conquered, which, in, province
intercepting, one of currents, for, another
bring, them, for, years
observed, object, to, sight of people
finding, herself, at, him
explain, infinite,,
force, Bagoas, for, King of kings
bowed down, head,,
leaving, path, by, Mbonga
angered, me, as, dwarf
heard, me, at, word
leave, thee, through, air
made, report, From, Points of kingdom
relieve, own, to, Joy
call, you, To, destiny
raising, himself, at, dinner
covered, face,,
know, little,,
bear, more,,
rub, sand, into, eyes
took out, me, to, relief
put, dollars,,
clear away, rheum,,
received, damage than loss, to, bed
left, him, into, palace
conquer, what, in, world
allow, passage of racers, to, shore
let, us, with, tale of ancestor
maintain, purpose, to, end
perfected, instrument,,
drink up, bowl of cream, as, punishment
said, Kiddiwee,,
distresses, 39,,
neglected, kingdom, since, marriage
approached, Ten-teh, for, departure
Seal, sepulchre, in, writing
occasioned, anxiety, in, circumstances
takes, notice of it, beyond, statement
drew, case, from, pocket
contain, himself, in, garden
lost, formation of start, behind, other
founded, power,,
join, us,,
turning, screw,,
observed, matter, at, all
thought, it, of, me
awaiting, him, in, voice
flow, emanations from citizen, Into, receiver
see, him,,
making, him,,
left, that,,
get, meat,,
bring, destruction, on, kingdom
dwelt, one, For, years
had, punishment than whipping, at, entreaty
lead, us, at, all
had, power, with, people
grow, fruit, as, shelter to age
stands, sovereign, Before, you
place, instrument, to, man
let, us,,
ask, me, by, queen
began, discussion, At, suggestion
See, infidels,,
swore, which, to, Isis
following, example, to, safety of huts
mean, Wind,,
done, which, for, recompense in return
have, connexion with operations, with, hand
gave, rest, with, flies
taking, care, of, kettles
regarding, him, in, solution of problem
remember, vows to Isis,,
Turn, twins, into, cathedral
take, ring, to, petition of children
rub, it, along, back
cause, figure, in, manner
love, me,,
carry, message, for, current
attack, us, by, means of spies
turn, them, into, porpoises
catch, number of insects, in, hand
meet, hand, for, years
asked, Sacharissa,,
owe, glory, to, love
considered, him, with, eyes
remember, it, in, box
purchased, thine, in, cavern of heart
unable, which, in, relations with wife
love, me,,
intercept, greeting, for, whom
see, it, of, sudden
wanted, what, for, moment
feared, apparition,,
imagine, somereversion,,
closed, cities, In, manner
seized, cake, about, head
lost, thee, to, me
allowed, crew, For, mile
acclaimed, leader, at, head of Pure
had, courage, in, air
make, offerings, to, me
comfort, him,,
watch, that,,
carry, them, to, front
understand, you,,
bent, head, of, speech
Speak, it,,
receiving, mark of approbation, At, period
gain, courage, until, then
settle, valley, from, here
gave up, himself, from, time
wish, me,,
lost, way, against, knee
Let, us, for, example
awakens, her,,
dispatched, four of them,,
use, size,,
caused, him, on, pretext
took out, stings, as, partridges
move, lips, at, her
wish, me,,
see, way, with, uncle
growing, fruit, On, bank of river
did, This, under, privation
preserved, them, with, curiosities
have, nobody, but, himself
wore, garments, like, Morven
fulfill, that, from, corners of world
use, arm, to, body
Put, village, on, side of lake
give, description of country, in, it
discover, means, from, throne
assuring, him, at, once
raised, door, to, top of cage
shrugged, shoulders, at, machine
fetching, things,,
Eat, it,,
attended, whom, in, progresses
remember, Brook,,
reaches, miles in length, to, parts of America
saw, him, from, search for Tarzan
keep, it, by, oath
took, them, against, them
thank, him,,
did, this, at, walls
applauded, piety of son,,
get, solution of mystery, from, spies
catch, them, at, turn
encountered, pike, into, jaws
educated, wisest, of, children
said, what,,
see, girls,,
mounted, face, to, own
take, whale, against, rocks
do, goddess,,
Keep, eyes, on, me
spoken, nothing, for, which
carved, effigy, of, years
lessened, dip of oars, at, last
fool, men of Mbonga, in, time
known, large, upon, shoulders
show, him,,
make, laws,,
contains, cities,,
rid, themselves, For, long
saw, Smaradása, in, wonder
do, things,,
beating, flax, at, time
satisfy, reader,,
possessing, eloquence, at, length
lost, power of movement, as, result of act
turn, galley, By, rule of race
own, valley,,
consider, What,,
let, thee, to, minister
had, trouble, upon, throne
burn, Fire of Persia, In, front of it
contains, houses,,
put up, money,,
applied, itself, on, little
Let, 's,,
wearing, emblems, in, robes of Osiris
eschewed, resort, for, present
address, yourself, of, whom
make, miles, in, map
issue, stock,,
added, weight, to, delivery
pinched, morsel of air, of, darkness
nearing, goal, at, point
run, risk, with, any of particulars
sat, star, below, brethren
tasted, it,,
have, votes,,
prove, theory, on, people
reach, presence, To, each of these
exclaimed, Mein,,
unveil, you, to, platform
took, her,,
reckoned, coach,,
rose, columns of smoke, on, abyss of space
reaching, him, with, Emperor
bringing about, it, upon, thee
threw, blackness, in, night
give, testimonials,,
do, This, of, you
unlocked, drawer in desk, into, den
bring, commission, upon, thee
ordered, coachman, at, shops
heard, words, to, me
means, what, to, world
inconvenience, traffic on Avenue,,
gave, sigh,,
had, eyes, than, own
gathering up, strength, than, confused
met, Numa, with, spears of raillery
saw, Briggs, from, loyalty from curiosity
thrust, himself, into, presence of Son
save, men, of, time
know, thee,,
waited, coming of devil-god, In, mass of ebony
destroy, herself, at, blow to end
saw, clergymen, through, which
made, map of country, on, scale ofa mile
saw, that, in, instant of charge
piercing, arm, than, sword
see, limbs of vermin, with, eye
used, it,,
regarding, obligations,,
serve, Ochus, At, feast
force, gaze, into, distances
clinch, girl in world, to, current
raise, eyelash, In, case
served, me, from, Lord
find, servants, upon, answer
sing, chants of awakening, with, wine
cover, country,,
hast, throne, beside, own
love, them,,
use, country, as, map
failed, him, in, measure
bore, brides, in, time
give, fruit, to, Arunodaya
said, number of 43things, after, that
let, me,,
say, this, to, him
cried, Tibbs,,
had, window, On, side
confused, them, with, quality
consume, weeds, by, pangs of hunger
couched, spear, upon, him
carry, rice, as, jewel
strip, coverings, from, you
afford, springs, of, infinity of matter
sold, themselves, in, balance
take, more, than, combination
add, Isis, to, number of queens
swept away, spear,,
issue, stock,,
have, time,,
place, it, In, journeys
think, fruit, than, fruit of birth in form
sprays, air, like, quadruped of wilds
asked, Linda,,
went, black, by, blow
cried, Bruno,,
Do, Thing,,
need, things,,
Let, us, in, which
have, one,,
leave, harmony of Pleiades, to, left
like, world, for, Sylvie
discompose, me, to, sea-voyages
stand, ground, for, long
had, mind, in, lap
instruct, me, to, me
present, encouragement, at, things
took, fruit, into, hand
make, bearers, of, me
see, sisterat,,
hinted, what, to, me
see, face above them, of, beauty of hand
have, nolessons,,
gave, message of Lord, with, sound
see, temple, to, it
elect, child,,
ere, this, in, way
raised, eyes, at, Smaradása
plans, mummery,,
are, name,,
trying, experiments,,
mark, any of friends,,
have, reason,,
cept, bandages,,
acknowledge, myself, from, nation
countest, flock,,
act, play,,
flung wide, gates of village, At, last
holds, key, by, Door
followed, him, Like, sheep
measured, finger, from, one of statues
make, offerings, like, others
stump, valley, for, themselves
wrapped up, it, in, handkerchief
cried, Coppertop,,
Show, path of out trouble, to, -morrow
eating, it,,
beheld, stranger, on, throne of star
fire, temples, for, rest
give, it,,
found, themselves, at, speed
overhears, thee, at, time of telling
dropped, oars, amidst, silence
entered, gates, for, words
measured, latter, on, purpose
said, Gangádhara,,
tied, eyes, with, handkerchief
describe, grate with particulars, on, spits
tell, you, at, feast
Thank, you,,
wiped, sweat, from, face
sits, star of Hope, on, throne of star
changed, himself, from, lion
make, day,,
desires, vengeance upon Ochus,,
keeps, vigil, with, Lucifer
dragged, Mweeza, into, forest
touching, prize, In, front of stand
seen, going,,
marking, it, with, stroke
poisoning, soul, to, mortals
thinking up, things, like, this
FINDS, SYMPATHY, IN, WOMEN
have, winter, by, garters
gave, cry,,
marked, everything, In, planet
know, I,,
made, me, for, you
Let, ’s,,
came, courage, with, morning
counterfeit, garb, for, reason
go, way,,
whisking, handkerchief, to, yi
replied, one,,
making, trial of fruit, of, body
having, What,,
seek, mandarin,,
screwing up, eyes, with, expression
swear, it, by, Isis
Bring, him,,
facing, it, with, houses with holidays
produce, what,,
fail, me, by, Isis
tells, lies,,
kicked off, sandals,,
comprehend, you, under, conditions
carried, me, into, gardens of court
prostrating, himself, before, One
see, them,,
denominate, creation of animalculæ, before, overthrow of earth
left, them, at, Friedberg
found out, plan,,
made, money, on, myself
left, queen, into, gardens
follow, me,,
try, it,,
close, it, of, itself
ate, one, at, Dione
knew, intonation of voices,,
miss, aim,,
hit, enemy, round, world
wearing, ’em, to, theater
know, it,,
move, it, from, east
hallows, less, with, love
spoke, law, of, which
watching, opportunity, under, one of them
reach, other, than, that of mandarin
make up, answers, with, them
makes, part of lives,,
told, you, through, shadows of forest
supported, Tan-yung,,
threw, himself, upon, bed
worth, effort,,
bring, Joqard, without, him
know, dogs of settlement, before, long
got, Prize, After, that
fell, shower of hail, In, meantime
take, it,,
asking, riddles, in, house
observing, proportion, at, all
had, opportunities, to, thought
playing, that, in, imperfection of memory
clutching, chains of swing, at, thought
built, house in village, on, which
drawing, arm, within, his
put, me, to, me
preparing, handkerchief, across, forehead
watched, man, with, feeling
exclaimed, Lissa,,
let, us, on, scene
trust, Bagoas,,
pushed, it,,
hit, what, infrontof, you
Let, me, to, conception
love, things,,
following, scent, to, one of gardeners
believe, it, with, George
offer, feasters, as, sacrifice to gods
break, word, to, myself
tearing, clothes, By, fortune
missed, me, on, corner of Avenue
Taking, strap, with, laughter
took, him, to, him
moved, hands, for, example
consoles, men, for, death of loved
leaving, Makarandiká, into, world of dreams
knew, me, in, hands
let, us, before, house
find, himself, into, dream
laying, honours, at, feet
made, cookies, to, door
gave, impulse, to, particle of air
take, chances,,
receive, bodies, in, it
love, George,,
possessed, him, as, insult
asked, Linda,,
Let, despair,,
carried, me, In, minutes
leave, house,,
open, shafts, to, hall
retained, one, than, other
heard, which, with, sounds
have, children, by, time
laughed, Coppertop,,
have, sympathy in aspirings,,
caused, speculation,,
found, difficulty from effect,,
have, any of family,,
Let, us,,
summoned, priests, with, besom of destruction
have, disposition,,
try, it, on, others
marry, somebody,,
flattened, wings, against, backs
met, people in sleighs, on, skis
roused, conjecture, by, night
determined, Glumdalclitch, for, future
understand, desire,,
clapped, hands, in, excitement
heard, voice, round, figure
love, us,,
marry, anybody,,
finding, him, With, design
concealed, adventures, of, resolution
have, some,,
asked, Linda,,
eat, fire, with, swine
had, words forall,,
let, me, for, all
believe, ears,,
received, them, To, dismay
bit, underlip, at, machine
read, letter of introduction, with, what
takes, weeks,,
cast up, earth, to, top of mole-hill
sweep, earthworms, into, oblivion
overflowing, bowls of fountain, From, apartment
broke, shin, against, shell of snail
crossed, road, to, halt
submits, himself, to, torture
keep, it,,
drove, them, to, forest
see, them, for, Sarojiní
flooded, enclosure, In, depths of opening
find, children,,
had, confidence, of, hand
tracing, impulse, from, what
given, air, in, end
possesses, mass of hair,,
following, course of Moselle, from, Coblentz
called, me,,
took, cudgel, with, strength
struggling, which,,
unites, Coblentz, on, bank
discouraged, passion, of, her
distributed, oranges,,
did, whatever,,
referring, effects, at, epochs
recovering, himself, on, sides of head
impress, tranquillity, upon, us
came, floods, to, deuce
recollect, it, for, instant
cried, Bruno,,
sucking, pulp of oranges, under, favor of Heaven
dismissed, suspicion,,
found, heart of Osiris, In, darkness
found, it, beneath, crust of snow
constructed, boma, In, circle about them
see, way of out it,,
wrung off, neck, by, one of servants
caught, word, at, moment
bowed, heads, in, sanctuary
had, business, at, Theater
making, him, of, tears
showing, me, about, them
has, reference to impulses, of, air
see, eyes,,
generalcauserieamong, individuals of audience, between, acts
call, me,,
do, that,,
invited, Glumdalclitch, to, apartments
taking, Bruno, in, arms
saw, them,,
thrust, themselves, about, streets
rose, spires of Coblentz, against, sun
release, us,,
crown, brows, through, courts of Heaven
presented, tickets, to, kinsmen
grasping, branch, from, fire
heard, sleigh-bells,,
strip, me, from, top
hear, you, to, term
used, perfumes, after, all
lend, children, for, minute
let, us, in, voice
desert, us, to, Herr
implies, relation of trust without embarrassment, in, return
took, freedom, in, day
bore, name, like, stalk of lotus
demanded, Linda,,
chanted, ritual, in, darkness
turns, mind, from, waters
came, horse, Around, turn of road toward village
edged, it, about, her
marked, name, for, example
held, flower, in, hand
recall, famine, on, rock
watched, her, to, him
gave, uneasiness, among, maids of honour
cried, voice from without,,
waved, arms,,
gave, feature, in, curves
threw, themselves, upon, faces
Itdidseem, fancy, to, myself
entreated, Glumdalclitch,,
seen, what, to, you
reached, dwelling of plain, of, tea
broke, stillness of verdure, from, them
turning, eyes, on, brother in- law
had, them, From, Noot
saw, reason for fires, by, blacks
pressed, them,,
murdered, one of acquaintance,,
seized, king, by, hand
ask, us, to, anybody
abhorred, kind of spectacles,,
take, you,,
see, place, of, atmosphere
open, ears,,
thrown, gloom, over, journey
withdrew, eyes, from, Arunodaya
dared, this,,
spouted up, quantity of blood, in, air
swinging, foot,,
knew, awe of fire,,
cried, Coppertop,,
investigating, fire, in, village of blacks
telling, her, for, permission
seen, atmosphere,,
teach, men—, in, University
face, it, at, length
hear, me, of, sea-voyages
seen, it, over, me
cross, thought of power,,
know, it,,
take, impression of town, From, spot
Turn on, receiver,,
carrying, sword, at, belt
had, time, To, day
understood, both, upon, pinch
bore, something of aspect, with, beams of wood
whispered, Words of Power, into, ear
losing, thee,,
