carry'd, Trade, at, timea
professed, much, in, theory
call, it, with, lady
wrote down, it,,
had, son,,
see, king,,
entered, carriage, at, station
rais'd, Fortunes, for, theHouse of Feathersdemolisht himonce
outstrip, you, in, moment of services
surrounding, seed-vessels of plant, in, down
tickled, palate, with, bu-balu
declare, itself, After, examination
driven out, rest, to, parchment
see, this, over, slates
possess, thee,,
grudge, him, to, god
accepting, monarch, for, sake
resembled, percha in use, as, buckingham
Robbing, Houses, by, sort of People
adopted, suggestion, On, arrival at Elveston
grudge, him,,
recommenced, conversation, at, point
created, that, with, arts
imagine, which, than, those
find, gratitude of people, in, history of world
brought, Complaints against them, to, Government
tell, me, at, heart
produce, combinations of color, Through, usefulness of old
find, fervour, at, moment
heard, something, through, jungle
had, Effect, in, measure
Take, rose, for, instance
selling, house on Avenue, to, Jersey
spare, pain,,
understand, Business, in, employment
approaching, house, with, impatience
kill, men, on, him
cupped, rose, in, hands
searched, jungle, in, direction of creature
carrying, more, than, number of passengers
caught, scent,,
tell, me, into, petals
Bought, meer, into, Conduct of Men of some
asked, Weng,,
took, him, on, -cloak
took, hold, of, me
invented, it, at, rate
consoles, man, in, ills
form, face,,
gave, hand, On, expiration of year
did, What,,
bethink, you, of, heart
resemble, one, at, midnight
spent, honeymoon, in, Italy
found, thing,,
rejoice, friend, in, age
inflamed, heart, in, annihilation
shut, note-book,,
bear, yoke, upon, necks of people
misread, sign,,
Consider, verdict, to, jury
spare, him, into, fire
affected, life,,
admire, treasures of Rome with paintings, At, last
see, face, into, them
let, me, out, regard for virtues
forgotten, one, in, life
put, ear, to, rose
receiv'd, check, in, meeting ofthe Feathers
awaits, us, in, action
availed, himself, of, permission
leading, life,,
heard, voice,,
assures, me, in, way
justify, defection, By, standard
procuring, Feathers,,
pursue, what,,
endeared, her, in, England
knew, deeds,,
represented, ideals of art, Among, masterpieces
mean, What,,
send up, Feathers, to, me
acquits, us,,
Spoke, cutter in charge, to, day
Crushing, it, to, her
won, place, in, literature
convey, wires, into, operation
took, me, to, those
arose, Numa, by, noise
wags, world,,
know, it, in, voice
cure, disorder, from, Capital
add, title, by, transcriber
remembers, birth,,
asked, Ozana,,
saw, woman, through, underbrush
compelled, them, by, wonder
has, features,,
encounter, obstacles, into, hands of those
made, home, of, Tanneries
licked, chops,,
forms, base of chain, in, ages
do, What, without, telegraph
Take, note, of, words
have, Laws, after, Laws
meet, one with bowl, About, place
Take, note, to, King
told, him,,
exposed, form, in, places
served, species,,
carry, him, upon, them
Pick, blossom, to, ear
need, change of raiment, by, token of Head
believe, sake,,
scorned, delight,,
flicked, end of tail,,
heard, me,,
suppress, it, in, Moon
took, hundreds of years,,
regard, War, before, light
carried, scent of Tarzan, in, direction
see, things,,
like, any of flowers,,
held, it,,
done, deeds, to, race
endured, state of stone, by, far
unfolded, paper, after, all
find, pieces of it, of, pottery
held up, hair,,
asked, another of jurymen,,
tell, story of birth,,
prostrated, himself,,
said, what, at, other
preserved, right to name, as, shoes
meana, Sort, in, Face of Sun
giving, heed, to, wind
advance, race, than, life of ease
received, assurance, at, time
reached, spot, from, throat
Godcannotapprove, motives as that,,
examines, prospect, to, right
Tell, me,,
attend, coming, for, you
thrown, gauntlet, in, face
approached, sounds,,
broke off, it,,
tell, stories,,
keep, kilns, Besides, this
devise, state of quiescence, a, table
ascend, rope-ladder, to, summit of bag
sheltered, Robin, about, which
hear, it,,
recognized, one before him, in, voice
imitated, hand,,
heard, sigh, at, back
loved, me,,
give off, perfumes,,
serving, pleasure,,
forgive, you,,
take out, handkerchief, through, branches of trees
broke off, it,,
repeal, Law, from, Country
watched, them,,
sign, it,,
write, this, in, piazza of summit
consulting, happiness, for, ourselves
have, nothing, to, this
distilling, perfumes, into, words
meant, mischief, like, man
accustomed, herself, to, which
present, appearance, in, sight
turning, amber, from, hue
think, things, of, me
have, speech, with, one of chamber
tell, stories,,
had, Stock of Governors in Articles, in, Matters
saw, him, to, breast
mastered, trade, In, years of labour
think, what,,
satisfy, hunger, of, necessaries of life of bread
did, itagainsthis,,
proves, nothing of sort,,
found, child, in, moment
escaped, sagacity of savans, to, me
determine, Causes of Negoce such asProtests, at, Loss
turned, county, than, other
raised, spear, of, shoulder
tell, thee, over, sea
Congratulate, Country, for, things
sent, jewels,,
find, words, on, bottom of plates at home
saw, tavern, Near, bridge
expressing, self, for, purpose
have, something, as, those of old
Read, them,,
see, nothing, with, moralist
lead, me, to, side
asked, one,,
wert, son of King, below, thee
opened, door,,
cast, weapon,,
wear, them,,
instructed, her, in, art
have, friends,,
put on, spectacles,,
grazed, shoulder,,
UNITEwas, Wordthro Nation in Trade, thro, Affairs
tell, stories, from, plants
relieve, people, of, fancy
wears, jewels save those,,
load, Goods, to, Port
close, eyes,,
Believe, it,,
tell, story,,
loves, him, at, last
played, obligato, near, door
used, salt, At, time
borrow, 500000, At, last
blotted, everything but image, from, mind of each
imperil, him, in, moment
receive, sight, to, him
propagated, what, at, events
enrich, shrines, to, Egypt
leave, surface, over, surface of jugs
made, deity, of, thee
saw, harm, in, this
let, salt, of, salt
expose, them, to, plight
took, Notice, of, it
hear, Arthur,,
tell, stories,,
broke, silence, with, words
grant, ills, In, word
made, clouds of smoke, On, Saturdays
saw, this, upon, Affairs in Country
rubbing, hands,,
acknowledged, memory of son, as, father
meet, lion, through, air
counted, them,,
laid down, law,,
tell, story,,
tapping, snuff-box, with, superiority
set, eyes, on, you
furiouslyat, Ruin, to, Measures for preservation
creating, garden, with, source of amusement
explain, paper, on, slates
observing, facts, into, laws
had, nature, from, childhood
bent, weapon,,
saves, world of trouble,,
held, which, to, reader
protect, him, On, hand
loved, him,,
drove, them, in, Moon
meet, thee, in, hut
folded, hands, in, prayer
makes, me, in, beginning
recovered, ground, by, system
tell, more, with, smile
spreading out, verses, on, knee
loved, vein of philosophy, to, all but herself
let, me,,
take, eyes, off, me
hurled, himself, In, fury
infused, spirit, into, imagination
has, story, in, garden
share, toils, over, lot
had, father, in, contingency of life save this
saw, apprentice, at, her
examine, Contents of Tract, from, Day
asked, herself, from, her
bring, garments, for, amusement
broken off, eternity, For, time
hotSolunarianscried, outPlots, of, Cogitator
shook, head,,
held, pair of shoes, In, hands
assure, you, on, authority
had, Remedy, with, Affairs
separated, gardens, with, minister
cast away, vestige of reminiscence,,
had, Consequence,,
confined, investigations, to, crawling
Thank, you,,
held out, pair of shoes, with, grin
take, cord, With, effort
leave, you,,
reach, tormentor, into, spine
utter, truth, to, which
done, thing,,
didnot, Which, of, cardboard
offer, prayers, in, troops
timeshebroke, silence,,
came, chant of monk, From, point of house
rippling, waters, to, shore
serve, you, to, rooms
regarded, road, by, which
know, it, over, verses
possest, Dissenters in Country, to, self
bowed, themselves, to, image
beset, husband, on, account
contemplating, me, like, idol
misunderstand, me,,
meet, charge, upon, scene
made, speeches,,
tell, World, in, Observations
got, money,,
having, breasts, to, middle
saw, it, concerning, whom
facing, water, against, sky
persuaded, mother, at, last
Let, us,,
harming, her, with, terror
see, that, from, mouth of gateway
wav'd, Things, into, Affairs of Nation for Similitude
settled, issues, in, turn
love, other, At, present
make, journey,,
pronounced, theorist, upon, investigation of means
Putting, Felina, on, ground
get, cuff, from, master
fix, period, by, us
stolen, Tibo,,
prophesied, things, At, school
demonstrated, knowledge of apprentice, With, exclamation of bravado
make, People of Sidon, to, image
omit, which, among, multitude of things
steal, him,,
bent, ear, over, one of faces
found, thee,,
see, object, by, way
hugged, boy, to, her
submitting, oneself, to, scars
kissed, son, At, words
understood, thing, in, estimation
imagined, friend, of, utterances
suffer, Tibo, from, her
want, us, from, which
harbour'd, AbrogratzianPrince, as, before
picking up, knife,,
demanded, sacrifice of happiness, on, remark
left, heart, behind, thee
felt, wave, at, him
had, fit,,
found, himself,,
had, axiom, on, path of Ram
undertook, support of mother, in, 1846
eyed, them, in, silence
make, this, in, which
omitted, Account of War, with, deal of Bravery
Placing, ear, to, blossom
releasing, you, in, conclusion
see, this, in, day
did, everything, for, books
aroused, loneliness, to, mother
took, part, Of, brothers
exist, antipodes, For, example
give, itsfullweight, to, argument
jolted, intimacy, to, death
throwing, inkstand, at, Lizard
putting, faith, in, people
did, what, with, principals of school
made, mark, on, slate
Mentreated, him, for, Services
touched, face, on, knee
demonstrate, futility in general, of, mouths of reasoners
Noticing, blossom with spots, to, it
saw, Tarzan, At, last
restrained, it, into, face
forget, look upon face, in, hands of priest
hovered, picture of arms, before, eyes
board, ship, At, rate
upbraid, Partyamong, with, Treatment of King
answered, Vane, with, smile
take, me, in, speech of apes
weary, other, as, bad
Believe, it,,
omit, Part of War, in, Months
take, me, to, lair of men
roused, himself, at, once
ask, Pundit, in, minute
sought, shutter, with, which
say, What,,
climbed, ladder, from, heat of idol
put, it, into, words
dispel, doubts, by, consent
Let, jury, in, tone
Let, me, with, Momaya
shifted, sword, to, hand
Pick, me, to, Dorothy
assuring, himself, to, slicing
found, Arthur, at, Hall-gate
love, them, for, you
tore, them, to, garments
told, one, from, you
love, her, to, daisy
exclaimed, teller,,
translated, words, to, mother
tell, you, from, day to day
had, horse,,
pick, me,,
seizing, Kingdom, into, Flame
drown, cries, upon, instruments of music
brought, things, without, question
saw, arms, above, edge of hollow
published, novel, in, 1849
expect, offer,,
make, excursion, upon, time
strained, Tibo, to, her
said, Alice,,
relate, story of adventure, before, rose
provide, matter for tale, around, fire
lift, themselves, for, time
knew, her,,
callMogenites, who, with, Forces
disputing, truism,,
Hold, tongue,,
brought, child, upon, hands
took, boat, at, stairs
divides, paradise of joy, from, dungeon of despair
shape, itself, To, end
caught, heart, by, day
hear, words, At, last
save, soul, of, anything
put, hand, into, reticule
sang, songs, upon, instruments
-witted, GallunarianMonarch, in, Case
break, faith, with, me
saw, them, through, face
saw, folly, after, luggage
wrote, works including novels, In, all
carry, violin, with, me
name, whom, for, moment
had, forecast, upon, him
bear, more, At, length
breaking off, engagement,,
hold, court, with, mission
count, them, on, fingers
lost, Opportunity, for, War against them
tell, story about home,,
gives, space of time, to, ambitions
here, What,,
acknowledging, King, As, Honesty of matter
cried, Justice, by, arm
left, heart, for, young as those
tell, story about home,,
spoken, words, to, her
soshebroke off, it, of, thing
recommending, them, by, Relation to Practice
loved, blood,,
theEarlbroke off, it,,
told, street, into, cheeks
read, Economy,,
challenge, condemnation of beauty, at, Aja
caught, eye, in, bed
justify, which, in, recital of stories
Tucking, violin, under, arm
made, acknowledgment of Monarch, upon, Progress of Matters
buy, rolls, At, bakery
have, birds, At, end of day
casting, limit, For, instance
have, this, on, authority
realized, which, under, charm of eyes
expressing, himself, at, trials
asked, Miss, among, writings
Pick, me,,
gave, scream of fright, At, this
dread, punishment, in, lectures in as actions
omitted, maxims, from, tale
named, god, from, king
lost, sight,,
saw, difference in matters, by, Reason
permitted, himself,,
pay, price of blood, by, Isis
had, Wishes, with, me
met, her, without, resistance
swore, it, by, Mother
confine, Soul, of, ancients
guilty, that, in, prosecution of War
had, sleep,,
enable, him, For, years
had, dream,,
puzzled, dogmaticians, By, by
have, it, among, themselves
mean, truth of Gravitation,,
compelling, him, notwithstanding, preoccupation of heart
had, Title, to, Ebronia
felt, blood, through, veins
know, reason,,
uttered, words,,
owed, it, to, Kepler
show, power, with, imagination
told, sister, about, that
Beg, pardon,,
watching, me, on, me
eaten, anything,,
embraced, which, at, once
write, Sentiments of Affair, At, last
saw, tree-bough, in, wind
throwing, door of apartment,,
bear, him, near, me
led, mathematician,,
had, right, to, one of milk
have, godmother as Miss, by, poems
left, her, on, hand
told, me, of, victory over vanguard
have, mercy, on, worms
enjoy, luxury of chat,,
formed, acquaintance with George, at, Cottage
closed, eyes,,
heard, voice, to, blossom
hear, tones of voice, of, Alice
puzzled, moles, by, which of roads
bear, fruit, in, Sidon
given, coffin, Of, late
getting, what, of, Bible
has, more, than, proportion of theverypoor
carry, you, to, islands of nights
boring, you, on, topic
cast, eyes, of, casket
drank, things, in, England
give, Scheme ofSolunarianHonesty, According, promise
give, more, than, proportion of help in charity
gave up, which, with, accident near house
splashed, way, at, feet
pick, some of them, to, voices of many
missed, what, with, prattling about roads
said, Generosity,,
make, prophecy, with, spirit of Mother
patted, lips, with, linen
accepted, Will of Crown in favour, according, Disposition
proffer, many, with, qualities
deduce, fact, from, works of God
keep, heart of childhood, to, herself
grudge, children, in, reward of piety
given, crown,,
find, me,,
has, health,,
advised, them, in, quarrel between Virtues
tried, daffodil,,
distributed, them, into, apartment
plac'd, Grandson, on, Throne
Muriel37does, more, in, way of teaching
forgotten, themselves, Upon, this
had, taste, in, common
had, something of Surprize, in, it
drew, back of forearm, across, mouth
appeared, trail of anemones, In, wake
attended, him, at, hazard
have, Fellows, to, Comrade
had on, bonnet, to, shore
have, time of it,,
closed, eyes, from, them
gave, shake, before, them
found, Goods on Board, from, Country
fill, room, with, radiance
matter, What, because, that
told, story of intrigue,,
Swear, thing,,
think out, it,,
twisted, mustache, on, enemy
bringing, delicacies, with, him
gladdens, gaze,,
had, children of own, for, whomThe
fancy, shout of scorn, with, which
carried, it, In, fact
apply, Story,,
approached, Kai, On, day
acknowledge, King ofEbronia, for, Advantage
plucked, cluster of lilacs,,
take, cap, to, Christine
doing, wonders, in, conjunction with improvement
opened, eyes,,
sing, story of home, on, stem
quenched, thirst, along, path behind him
passed, lips, through, it
requiring, you, against, bond
rumbling out, roars, of, body
acknowledge, him,,
worm, that, of, household
seen, others like her, with, eyes
threw, damp, on, party
approaching, us, at, rate of miles
heard, him, within, sight
hid, what, at, me
took, place, in, 1887
Caress, him, to, Ambassador
heard, her, of, matters
picked up, Kitten, in, shadow of hedge
saw, forest with trees, in, place
coming, face to face, At, sound of feet
accompany, you, of, friendship
saw, man, at, spot
considered, that, beyond, attacks of trouble
tell, us, into, it
warm, limbs of children,,
spare, squabbles, in, conversation
contributed, labour, to, needs of community
owing, Man, into, Action
served, them, over, food
touching, cask of wine,,
took, farewell of her, By, chance
had, bowl of milk, on, floor
Imagine, faces of Economy,,
swallowed up, them, from, table
rubbed, hands, for, champagne
followed, Dolly, to, rooms
last, life-time, behind, him
bore, testimony, into, side-pockets
watching, face, to, side
brought, you, before, time
called, one, at, some of jokes
remember, flight on railroad,,
make, them, with, beds
had, benefit of it,,
own'd, King,,
pulled, covers, over, her
wearing, block, into, presence of Shan
overshadow, wedding,,
said, words, in, Jerusalem
came, wave of perfume, from, creeper
do, whatever, in, World
caught, glimpse of objects, by, chance
Tell, me,,
condemn, you, upon, person
help, others, to, me
viewing, face,,
lifted, pitcher, from, head
led, Queen, as, merit in writings
tell, kind of story,,
found, him, On, path to chamber
make up, sum of mortification, like, mad
has, reality, upon, it
stand, it, in, spite of heroism
preferred, travelling by train, For, part
possessmoneyinstead, ofmaterialwealth,,
answer, question, with, tears
acknowledge, King, against, him
compose, himself, to, lips
have, windows,,
cast, herself, into, arms
set, it, for, authors
do, what, for, delight
shown, mind,,
makes, Name of aSolunarianscandalous, to, Moon
let, us,,
bring, sense of rest, to, reader
find, something, upon, which
waste, lives, At, end of voyage
declare, knowledge of sort, of, memory
having, ache, at, time
watched, her, like, one in dream
treated, black, for, time
makes, goodness,,
given, what, In, return for this
adding, words, of, vocabulary
bow, Excellence,,
owes, tome, in, vain
gained, hand, at, heart
placing, herself, at, last
seeing, them, by, Home
taken, son,,
concerns, story of Wang,,
lifting, brow, with, smile
take up, abode, with, mortal
clasped, hands, upon, heart
said, enough, at, project
make, Peace with Gallunarians, From, circumstance of Man
take, him,,
make, doubt, For, part
Doing, stroke o’ work, for, theirselves
heard, more,,
finding, him, in, danger
require, command,,
devoured, byennui,,
representhonestlabourat, all,,
uttered, cry, around, him
took, hint, to, house
like, it, for, while
thought, this,,
choked, other, in, throat
trace, it, from, owner to owner
removed, potatoes, from, pockets
please, you, in, City
get, better, with, Terms
convince, me, in, attempt
doing, something,,
declaring, oneself,,
approached, that, in, cover of huts
put, himself, into, case of Desperation
maintaining, Tablets, than, irregularity
heard, sigh,,
holding, him, on, ground
called, it, with, affairs
espied, carriage,,
thrown up, screen about activities, from, enchantment
disturbed, self-complacency of philosophers, by, means
involves, fallacy,,
drawing, Sword, with, Lipfrom
hearing, songs in operetta, in, suit
moving, me,,
discovered, spell,,
concerning, themselves, in, Matter
adding, howlings, to, those of artist
seizing, sword, at, her
threw back, veil, in, luxuries as herring
render, consequences, in, word
smiled, smile, of, consternation
finding, herself, to, London
includes, Part of Trade, ofEbroniain, Hands of Gallunarians
throttle, screamer, into, hut
know, Christine,,
mean, what,,
pleases, you,,
left, Stone, of, Ruin of Trade
asked, Wizard,,
admit, truth of this, After, thought
take, daylight, for, night
saved, tips, to, theatre
believe, both of them, at, me
devised, that,,
encumbered, earth, of, men
retarded, journey, to, appointment
spend, it, from, standpoint of humanrights
sought, him, in, spirit
objected, Right to Crown,,
filled, breasts of blacks, with, panic of terror
wore, which, by, display of weapons
lent, spice of interest, to, adventures
set up, Usurper, by, Manifesto
had, gall of bullock with heart,,
ask, Gentlemen, on, Throne
positioned, Wang,,
exhausted, him, at, length
tell, me, through, place
doing, wrong,,
own, Usurper,,
attained, fluency, in, way
bought, dress, for, Christine
found, pleasure, to, sight of death
doubting, reason, in, swing of perplexity
clear, them, of, one of Charges
ensconce, myself, by, poverty
avenged, death of Kala, in, accomplishment of it
held up, hands, in, amazement
see, image of Dagon, to, housetops
Do, good, for, nothing
saw, image of Dagon, from, place
suffering, nails, of, expediency
except, case of dogs, As, Republicanism
made, reflections, During, hour in residence
lead, boy of summers,,
bought, Christine, with, savings
dragged, which, still, whom
had, view of Lyrae, through, spy-glass
conduct, enterprises, in, society of persons
finished, toilet, before, breakfast
saw, thee, in, wood
have, rag, with, joy
threw, figure, into, relief
resembles, him, than, sun
corrected, me,,
involved, himself, for, benefit of those
watched, thee, from, lips
gave, him, to, priest
conceal, fact, In, manner of transactions
threw out, flame, to, shadows
perform, duties, in, health
brought, thee, to, thyself
n'd, him, in, particular
have, feeling, with, Mimics
tells, me, within, century
Excuse, me,,
climbed, ladder, upon, hands of idol
saw, him,,
ofapplyingthe, term, to, anyindividual
let, us,,
causing, nights,,
Had, Cheng,,
held up, it, before, him
gratifies, fancy, to, him
have, time, at, Tenes
tore, wafer, from, piece of paper
saw, him, toward, him
devour, flesh,,
reproach, Nations, in, manner
played, any of tricks, through, streets of Vienna
take, Felina, to, Oz
claimed, him, like, others
kept, silence,,
deny, god,,
have, nothing, As, theEagle
Given, craving,,
threw, herself, at, feet
asked, Dorothy,,
pass, examination of degree, for, post
theEaglehas, Title by Proximity, Without, doubt
confound, fellow,,
does, good, bygivingthe, money
accept, that, of, you
set aside, years, for, study
made, myself, in, particular
quit, Morals, against, King
trouble, you, for, pounds
filled, him, with, consternation
question, Understanding,,
said, that,,
hiss, curse, at, him
try, me, to, thee
let, us,,
drink, tea, in, hours
entwine, actuality of Hsi, on, this
crave, leave,,
seized, him,,
have, pounds,,
see, it, near, which
followed, Ozana, to, door
cursed, him, in, voice
acquire, sum as taels, To, those
hear, Title of King,,
took, refuge, at, point
kill, mother,,
brave, storm, in, spite of display
take, this,,
faced, sun, with, glories
have, money,,
held out, flower in colour, towards, him
pick, one of blossoms, to, story
dazzled, eyes of young, to, heart
found, sums of money, in, position
admitting, orb, by, host of suns
holding, hands, to, knees
reads, it,,
Forgive, me,,
emerged, swans, under, branches of bush
holding, violin, with, fingers
tire, you, with, minutiae of detail
reached, point, with, sigh of relief
does, this, about, centre of gravity
doing, good,,
carry, us, over, Desert
followed, spoor of Horta, upon, tracks of Gomangani
consider, which, of, infinity of lines
carry, you,,
make, taels, on, pretext
buy, anything, of, mother
meet, vampire, on, edge of precipice
drew, sword, at, side
leave, her, to, soul
laid, facts, before, spirits of ancestors
watching, him, at, Natabhrúkutí
accompanied, request,,
point out, them, to, us
told, story, To, Tarzan
deserting, me, before, which
indicate, state of affairs, to, them
groaned, sympathy with Fanny, to, Justice
complete, circle of crimes, on, dog of Sidonian
done, What, of, hunger
passed, way, as, suns
shook, head,,
held, attention, along, trail
gaining, it, As, probability
rend, air, by, threat of vat
left, you, to, India
lifted, sword, in, madness
find, children, in, pond
Had, view of asteroids, with, interest
told, him, toward, north
let, him, to, Honour of Conduct
batter, roofs, in, fury
relieve, Pariah, by, inequalities of condition
save, one of children,,
Loosing, veil, over, head
want, more,,
done, good,,
brave, elements, like, beasts
declaring, him, than, King Without Crown
following, two, by, overlapping of footprints
touch, her, in, veil of Isis
abandoning, men, upon, iniquity
bearing, resemblance to humanity, as, lunarians
cut, face, by, storm
feeling, infirmities of time, of, late
walked, one on side, to, them
calledmethe, wicked, of, vices
conceive, masses,,
say, what,,
ask, me,,
meet, stranger,,
give over, you, to, dreams
placed, foot, on, back of one
uprooted, society,,
illumined, face, At, once
caught, something in spoor, At, first
regarded, me, with, suspicion
tell, thee,,
had, Victory, with, thing
do, harm, in, tribulation
supported, her,,
withdrew, violin, from, case
confines, itself, like, bees
cast down, sword,,
flashed, attitude of Momaya, at, once
call, it, In, condition
penetrating, rooms, through, mansion
take up, abode, As, me
spoke, us, to, day
Holding, Felina, in, lap
lay, it, like, breezes
embody, something in nature, to, ourselves
occasion, Copy of Verses, about, Moon
give, alms, to, horror
mounted, swan,,
shot, bolt, to, door
make out, it, after, all
preparing, ground for fountain, for, months
has, perception, At, moment
lifted, veil, about, queen
like, instance fromreallife,,
attained, breadth,,
signaled, swans, with, strokes of wings
entered, breast of legislator, As, myself
taking, place, without, Issue
saw, cottage, behind, her
stolen, balu,,
brave, Tenes, in, palace
reaches, object, of, money
find, body of husband, to, life
thank, you,,
left, Mount, In, time
prevent, Succession of Line, to, Grandson of Sister
uprooted, town, of, antiquarians
hold, pearls, unlike, it
needs, classification,,
seizes, it, in, Possession
carried, her, with, which
TheEaglealledges, Renunciation, as, Will of King
follow, it,,
touch, it,,
boring, you,,
building, what, of, them
make, application of History, to, Son
do, justice, at, last
have, Right, by, Gift
resting, head, into, chair
sent, whom, to, land
come, Bukawai, with, bit of flesh
