lies, distance from any, of, way
enlisting, sympathy, with, hope
knows, me, to, best of ability
preserves, which, By, aid of medals
forced, which, Of, date of origin
confess, myself, Touching, derivation of name
select, nothing, Among, multitude of opinions
commit, myself, on, theme of importance
See, Blunderbuzzard,,
consult, notes in autograph with Sub-Commentaries,,
envelops, date of foundation, Notwithstanding, obscurity
remember, difference in appearance,,
assign, reason, For, this
extends, row of houses, Round, skirts of valley
having, backs, on, hills
has, garden with path, before, it
carve, objects,,
do, these, with, ingenuity
have, pieces, over, front
having, stomach with hole, through, which
wears, cap like sugar-loaf, with, ribbons
has, pair of stockings,,
has, watch, In, hand
fastened, which, By, side
attending, pig,,
have, hats, to, thighs
has, pipe, in, mouth
takes, puff,,
picking up, leaves, from, cabbages
resembles, that of boys,,
make, smoke, than, theirs
has, watch, Like, them
say, truth, than, watch
wears, countenance, with, leg
have, coats, than, inhabitants of Vondervotteimittiss
had, meetings, Since, sojourn in borough
has, faces, from, quarters
have, anything, to, it
have, reference, From, period of antiquity
keeping, time,,
say, o’clock, like, echo
hold, offices, in, respect
painted, estate of Vondervotteimittiss,,
wanted, minutes of noon, on, day before yesterday
attracted, attention, in, arm-chair
wanted, minutes, By, time
descended, hills, at, rate
had, nose, from, ear
dangled, length of handkerchief, from, one of pockets
carried, bras, Under, arm
cutting, manner of steps, from, which
bless, me,,
occasioned, indignation, in, steps
had, chance, into, midst of them
seized, him, at, once
aroused, inhabitants, to, act of vengeance
doing, something, at, moment
had, time, to, manœuvres
echoed, gentleman in arm-chair,,
said, watch of vrow,,
continued, bell,,
dropping, voices,,
putting up, watches,,
dropping, pipes, over, knees
taken, possession of thing, in, face
contain, themselves, upon, furniture
resented, it, than, all
make, matters, to, utmost
catch, glimpse of scoundrel, through, smoke
held, rope, In, teeth
lay, fiddle, On, lap
Let, us, in, body
taking, hold of nose, with, hands
saw, this, for, joy
feel, way, in, science
swallowed, dozen of drams,,
asked, me, of, age
follow, nose,,
gave, pull, upon, spot
be, What,,
paid, attention, into, shop of artist
holding, poodle, for, portrait
approached, artist,,
take, What, for, it
warrant, it, to, light
blowing, it,,
touching, it, with, reverence
twisting, it, to, side
surveying, it, through, microscope
turning up, it,,
have, them,,
engaged, rooms in street, with, portrait of proboscis
quoted, Porphyry,,
quoted, Turgôt,,
mentioned, Muriton of tongue,,
shook, head, at, Clos
had, heads, by, cow with number
informed, us, about, fires about aëriforms
turned up, nose, of, myself
paid, visit,,
tapping, me, ’s, Almack
seizing, me, by, hands
exchanged, cards,,
shot off, nose, At, Farm
have, nose,,
grant, you, in, Fudge
accused, him, in, fact
required, logic of Brownson,,
do, justice, in, town
establishing, Pot, to, himself
taking up, residence,,
did, more, to, that of Gazette
give, paragraphs,,
awaited, reply of Smith, with, anxiety
write, word, in, it
drove, him, to, desperation
write, word, without, O
yielding, point, to, John
make, alteration in style,,
Perish, thought,,
has, honor, with, chivalry of determination
Told, you,,
handed, MS,,
made, commencement, to, whom
threw, himself, by, success
paint, astonishment, to, purpose
set up, nothing, for, breath
gouge out, eyes,,
render, substitution in question, in, times
employ, character, As, Bob
x, paragrab, to, himself
reading, leader, in, -Pot
’re, hxmx,,
riding, him, by, populace
discover, object, at, length
thought, joke,,
shown, X-uberance of fancy,,
admitted, X-entric,,
suppose, design, in, way
set, X-ample, to, posterity
lynching, one, to, extremity
make, nothing of problem,,
ed, paragrab, with, attention
had, doubt about matter at all, for, part
give, date, to, story
say, nothing, Of, doctrines of falsity
être, seuls, of, incredulity
give, words of Parisian, For, example
have, fall, in, words of prophecy
given, rise, to, consequences
exercised, influence in affairs,,
had, magnificence, than, all
setting, families, at, variance
implied, anything, with, animosity
prevented, participation in dangers, at, epoch of narrative
followed, him,,
have, meaning, In, city
attending, administration of father, From, circumstances
-Heroded, Herod, for, space of days
gave, vassals,,
added, crime of incendiary, On, night of day
represented, forms of ancestors, upon, walls
arose, expression, On, lip
remove, it,,
reconciled, feelings, with, difficulty
withdraw, glance, from, fascination of tapestry
diverted, attention, with, exertion
altered, position, To, horror
wore, expression, with, red
threw open, it, into, chamber
lighten, depression of spirits, into, air
encountered, equerries, At, gate of palace
restraining, plunges of horse, With, difficulty
get, him, in, tone of voice
caught, him, with, rage
Supposing, him, to, stud of horses
disclaim, title to creature,,
supposed, them, on, forehead
know, duty, into, presence of noble
whispered, account of disappearance, into, ear
recovered, composure, upon, countenance
adopted, which, of, death of hunter
took, place, From, date
disappointed, expectation, in, accordance with views
bestrode, which, beyond, limits of domain
honor, festivals, with, presence
express, hope,,
attributed, alteration in conduct, to, sorrow of son for loss
suggested, idea of -consequence,,
attain, strength, from, example of propensities
gave, character, with, events
exceed, expectations of imaginative, in, leap
had, animal, by, appellations
enter, enclosure of stall, at, distance from rest
caught, steed, from, conflagration
exciting, attention, to, labors of chase
doubt, ardor of affection, Among, retinue of Baron
had, effrontery, at, all
attracted, attention,,
made, progress, in, wonder
rivetted, attention of multitude, in, feelings of crowd
bearing, rider, Up, avenue of oaks
gave, evidence of exertion, from, lips
clearing, way, above, roaring of flames
enveloped, building, like, shroud
led, me, During, autumn of 18
visited, place of kind, to, companion
pleading, haste, To, this
begged, me, with, gratification of curiosity
bade, me,,
had, knowledge of superintendent, in, fact
made, acquaintance of Maillard, For, himself
thanked, him, from, road
rode, miles, Through, wood
inspired, me, with, dread
perceived, it, to, way
accosted, companion, In, instant
presented, me,,
ushered, me, into, parlor
singing, aria from Bellini, At, piano
perceived, traces of sorrow in countenance, to, taste
excited, feeling of respect, in, mourning
left, liberty, at, Paris
Keeping, impressions, in, view
confined, remarks, to, topics
said, that, in, manner
brought, tray with fruit, of, which
turned, eyes, in, manner
find, much, of, forethought
permitted, privilege,,
given, trial, in, house
did, thing,,
paid, visit, at, period
contradicted, fancies,,
encouraged, them, On, contrary
touches, reason of madman, as, absurdum
had, men, for, example
accuse, patient, upon, thing
perform, wonders, In, manner
put, faith, in, amusements of kind such music
treat, individual, for, disorder
set, lunatic,,
repose, confidence in understanding,,
taking, turn of fury, to, crisis
had, disadvantages,,
Believe, nothing,,
misled, you, about, ourMaisons de Santé
take, you, After, dinner
let, you, at, present
spoil, appetite for dinner, To, mind
give, veal a Menehoult,,
consider, taste, by, means
wore, bosoms, for, example
fitted, wearers,,
discovered, girl, to, whom
seen, her, in, mourning
caused, me, at, first
had, nothing, of, elegance
formed, wing of château, in, itself
feasted, Anakim,,
witnessed, expenditure of things, in, life
find, place, in, arrangements
seated, people with fiddles, in, attendance
annoyed, me, at, intervals
took, seat, at, hand of host
talked, deal, as, usual
having, reference to thewhimsof,,
had, fellow, at, right
supply, tea-pot,,
polish, himself, with, buckskin
had, ado, within, bounds
eat, nothing but thistles, For, time
kicking out, heels,,
keep, feet, to, yourself
comprehend, you, without, this
imagined, himself, Upon, word
do, honor, with, you
Allow, me,,
Thank, you, to, St.
change, plate,,
change, plate,,
help, myself, to, some of ham
have, none of chat,,
taking up, thread of conversation, near, foot of table
mean, man, for, bottle of champagne
said, nothing, to, Monsieur
mistook, himself, for, frog
seen, him,,
croak, gh,,
take, himself, between, finger
persecuted, cook, into, pies
fancied, himself, through, love
imagined, one,,
convinced, you,,
had, passion for oratory, from, display
call, him, in, fact
see, him, with, laughter
allow, me, at, top of voice
had, crotchet, with, sense
flapped, wings, with, effect
conduct, yourself,,
hung down, head,,
resumed, theme,,
thought, mode of habiliment, instead, inside of clothes
withhold, Ma’m’selle, from, seats
saw, set of people, in, life
inquire, cause of disturbance,,
get up, howl, in, concert
Hold, tongues, in, rage
maintained, silence, for, minute
obeyed, Monsieur, As, lady
addressing, him, to, Monsieur
has, eccentricities,,
enjoy, life, in, South
understand, you, By, bye
happy, which, to, Professor
hear, you,,
heard, either of Doctor,,
seek out, writings, with, care
confess, it, of, myself
pressing, hand, in, glass of Sauterne
followed, example, without, stint
perpetrated, absurdities, like, bulls of Phalaris
continued, conversation, In, meantime
stood, chance, in, key
mentioned, something, in, ear
permit, them, in, opinion
has, project, in, view
put, him, in, straitjacket
found, themselves, into, cells
give, trial, in, conspiracy for overthrow
exchange, places,,
see, establishment,,
admitted, visitors, at, all
let in, him, by, way of variety
gammoned, him, about, business
had, season of it, In, meantime
doffed, clothes, with, wardrobe
drink, it, with, wine
tell, you,,
finished, sentence, beneath, windows
threw, himself, to, astonishment
expected, resolution, at, hands
do, duty, for, minutes
leaped, gentleman, upon, -table among bottles
replicate, text,,
settled, himself,,
included, references,,
set, himself, At, moment
hearing, popping of champagne, at, length
carry out, plan,,
uncover, evidence U.S,,
achieve, end, in, which
uttered, that, upon, note
issue, number of copies, owing, freedom of passages
feels, which,,
Cock, de-dooooooh, in, corner
make, essay in art, to, me
taking, him, to, fact
forget, number, at, last
have, fears, of, presumption
held, prospects of drink,,
neglect, construction, in, age
forget, emotions of wonder, with, which
clear, myself, of, charge
establish, record, for, days
stained, hands of She, with, blood
saw, lakes of waters, through, heat
call, her,,
received, beating, after, which
called, him, to, coolness
include, note, by, entirety of writings
contain, matter of import, of, contrition of character
having, nothing, by, sister
made, her, in, mind
giving, account of lunatic, to, rebellion
doing, something, as, business
led, her, down, road
attempt, it, in, tongue
haunted, him, by, night
said, this,,
introduced, me, to, companion
had, expression of inquiry, at, candle
boast, writers, by, assault of words
thought over, it, to, her
seemed, shape, of, it
demanded, Master,,
shaking, head,,
make, havoc rather building, by, authors
left, floor of desert, for, carpet of grass
shook, leaves, Over, head
went, Alice, In, moment
REACHED, COTTAGE,,
had, moment, like, tunnel
gave, freedom, At, length
sent, me, by, friend
boots, it, upon, preterit
flung, himself, upon, dog
had, plenty of time, about, her
putting, head, on, side
address, you, of, duties
KNEW, ALICE,,
see, anything, to, what
making, music, over, surface of Sea
gave, trouble, at, all
gave, dukedom, to, him
found, that, in, place
have, wit, than, inventive
give, name, to, custom of country
affords, few, in, which
contain, notebooks, in, parchment
took down, jar, from, one of shelves
approached, edifice, At, last
choose, name, of, age
felt, it, as, such
drew, hand, upon, head of Moor
think, nothing, to, herself
explained, it,,
presented, picture of loveliness, AT, ease
brought, them, over, gifts
owned, notebooks, on, one of them
give, pleasure, among, rich
point out, it, in, map
found, exercise, in, distinctions of thought
signalizing, abdication of sceptre, by, bequest to posterity
seen, him, upon, bough of giant
think, me, at, home
name, her, after, choir of nymphs
produce, effect of humour, by, use of convention
say, anything about it, off, top of house
quitted, which,,
admit, naturalness of interest, before, eye
sipped, drink,,
follow, sheet upon sheet of shorthand, After, these
swim, seas, of, winds
take, master-work of Julian, with, pride
produce, effect of philosophy, at, time
object, what, to, Sea-nymph
said, nothing about it, to, anybody
fulfilled, Law,,
decipher, it, to, system
please, you, of, protection
read, thoughts, through, brain
did, things,,
admiring, baby,,
outgone, merits, for, affections
had, which, in, paper
paid, Price,,
gleaned, truth, from, thoughts
say, much, Of, ancestors
fulfilled, law,,
discovered, key, at, breakfast
make, you, into, pages
paid, price,,
asked, he, in, garments of white
inspires, all about it, with, veneration
ACCEPT, OFFER,,
undone, niceness of dress, off, horse
seen, him, in, life
thought, themselves, in, clothes to kitchenmaid
accomplished, journey through Desert,,
endured, days, under, sky of brass
asked, merchant,,
read, it,,
beginning, which, in, way own
dressed, itself, By, six in morning
Let, me, in, lessons in schoolroom
carried, him,,
Let, reader, of, them
finished, drink, before, him
recited, poem in honor, from, epoch
regarding, him, with, stare
admired, baby, at, him
threatened, me, by, Shapes
puts on, cloak of mists, with, footfalls of fairies
bound, it, with, care
gave, matter,,
breathed, divineafflatus, into, me
had, idea,,
attained, Outer-Edge- Of- Things,,
found, himself, upon, her
gulped, drink,,
fulfilled, Law, in, notebooks
scratched, head, into, shock of hair
pardon, me,,
fall, earth,,
had, drink, from, corner of eye
put up, hand, to, wig
explains, which, For, reasons
envied, coat of hair,,
flanked, side of gateway, upon, tapestries
left behind, things of man--, to, heart
hid, something of truth, in, one of them
raising, me, after, relative
know, naught against it, of, town of Salem
find, appreciation, into, words
paid, Price,,
harbored, hope, in, hair
surpassed, all, from, vertes
have, head,,
envision, sorts of possibilities, by, glow of alcohol
walking, two, with, coronets
moves, me, of, things
quote, passages,,
seen, This,,
do, that,,
ask, Thyself, for, little
making, mouth, into, circle
slew, whom, At, Kôr
kill, birds, Upon, whole
watched, her, for, food
mean, what, through, air
finished, drink, on, bar
encourage, you, in, beginning of things
wreathed, itself, across, threshold
overheard, statement, to, ways
make out, that,,
see, it,,
inspecting, print, from, exit
carry, him, to, chapel
read, sentences, with, what
pick up, him,,
found, home, for, while
repay, it,,
miss, me, to, -night
doubt, it,,
discover, anything,,
make, break, for, it
deplore, lack of appreciation, In, connection with achievements
liked, Taug,,
ended, conference, with, best
blame, millions of readers, in, reply
stand, glory, In, magic of kiss
borne, him, within, year
enlightened, me,,
seize, Pisah, by, side
let, anything,,
knows, end,,
see, Truth, by, fog of Things
discourage, me, by, comparison with abortions
receive, assurance of glass, to, heaven
burnt, fellows, at, stake
tell, everything,,
hear, Truth, by, din of Things
came, one of ideas, At, length
please, them, above, mortals
made, point, as, one
struck, it, upon, trimmings of muff
named, Daughter, of, fears as maid
think, Truth, by, whirl of Things
took, look, Within, foot of door
carrying, baskets of flowers, before, nurse
find, stuff, in, attempt
got, volumes, From, rubbish of book-stall in corner
feel, Truth, by, weight of Things
catch, bat, in, air
speak, Truth, by, dust of Things
lasted, moment, in, invasion of thing
undoing, tangle in tassel, into, corridor
cast down, himself, at, point along road
eat, bats,,
like, you, by, name
eat, bats, to, herself
bared, fangs, upon, turf
shook, rose, to, eldest
denoting, intention, Across, glade
eat, bats,,
remembering, trifle, From, third
eat, cats,,
answer, question,,
rubbing, hands, on, chair
Found, bones, in, Desert
indicate, nature, towards, departure
held, paints, upon, her
watched, Taug, For, minutes
recollect, which, From, fourth
seen, whom, among, group of children
saw, caress of paw, to, ground
uttering, cries of apprehension, At, display
taken, This, to, end
Found, graves, by, way
saw, Desert, with, bones
regard, details, to, Kai
given, that,,
batting, eyes,,
held, tray of slippers, with, frock of yellow
raised, herself, at, Tarzan
plucked, blossom, from, bush
had, shadow over it,,
bore, jewels,,
saved, trouble, in, life
touch, him, about, her
leftinsidethe, room,,
lolling out, tongues, in, attendance
regarded, another, in, voice
Take, care,,
let, baby,,
crossed, threshold, With, step with head
went, Alice, like, wind
added, that of Lung, to, which
saw, that, in, instant
call, her, with, laugh like crow
gave, dressing, after, fashion
spread, mat, By, profession
turned, corner, in, hall
seated, herself, by, side of -table
sent, bedlamite, to, bed
turn, feet, For, cause
compiled, Books, to, degree
say, baby, in, tone
peeps out, mortal in me,,
said, clerk,,
had, gestures with hands, of, unction
kiss, him,,
loved, her, than, any of servants
told, Tale of King, in, Room in Temple
open, any of them, at, rate
giving, meaning, between, Priapusa
tried, key, on, time
has, audacity, of, us
laid, himself, upon, couch
cried, nurse,,
reached, end of block,,
done, it, at, you
opened, door, into, passage
seen, him,,
learn, that, of, craft
rustled, leaves, Without, Temple
holds, breath, on, day
pursue, subject of she, by, means
have, vision of what, to, soul
have, head,,
told, story of arrival, with, roses
bend, brain, in, fact
cost, penny,,
repeated, gentlemen in waiting,,
creating, impression,,
sensed, fight,,
overhangs, sea, on, cliff
received, communication from person,,
break, monotony of life,,
echoed, heralds,,
depicting, embarrassment of mandarins into vats, of, illiterate of sexes
surpassed, yourself, to, -night
lay, respect for bit, In, brain
tells, me, with, company
flatters, me, with, giggle under mask
find, contentment, of, virtues of poor
slain, Tublat, With, it
formed, itself, towards, palace
costs, what,,
have, talent in world, to, night
find, key, by, door
stretched, herself, on, tiptoe
forgot, troubles, Inside, den of din
require, stories, with, emotions
receiving, tremors of media, as, system
consider, story, to, company
knew, things, about, Tarzan
named, Divine, in, dream
wiping off, kisses, with, handkerchief
translate, thing, from, physics
taste, it, in, fact
slipped away, gown, before, mirror
sipped, it, about, bar
possessing, attributes of one, throughout, Empire
follow, way of majority, For, time
making, weal, for, ourselves
cut, them, upon, Oppodeldoc
saw, man in tweeds, In, corner of room
begin, Tale of King, for, you
given, opportunity,,
began, that,,
following, ourfancies, of, -room
have, name than one,,
knows, nothing of me, with, air
tell, story about Master, about, something
befitted, Goddess,,
reached, side,,
called, fax, by, schoolmaster
composing, betterlines,,
requires, accompaniment of drum, within, limits of day
treasured up, precept, in, recesses of mind
seen, thing,,
seen, bulls, for, shes
learn, tocount,,
Have, drink,,
sent, ship, to, Indies
forgotten, key, to, door
await, footsteps, like, flash of lightning
insulted, admirers, upon, haunches
conceived, idea, with, nonsense
seen, Venus, in, Vatican
made, impression, upon, mind
hurled, taunts, at, them
see, God, in, one of glorious
know, Majesty,,
publishing, Melodies, for, Drum
advise, you, to, herself
Got, drink,,
wore, waistcoats,,
dropped, him, on, stairs
call, Mumga, with, stick
summoning, mate, at, moth
gave, advice, into, eyes
has, assurance,,
Let, us,,
see, God, in, another of garments
help, him,,
make, Cluny, with, pantoufles
help, him,,
found, him,,
makeonerespectable, person,,
made, lunge, for, Tarzan
sought, track, from, shadow of trees
cried, group, into, shouts of laughter
shook, head,,
perused, this, to, point
promise, readers, into, secret
opened, it, on, box
read, parable of truths,,
have, pleasure, in, devices
found, one, On, road
experiencecompassionfor, fellow, As, Oppodeldoc
inhabited, halls of goddess, in, Egypt
finding, none of them, to, mind
aimed, blow, above, head
eat, it, under, door
take down, sail, At, moment
hear, news, in, minute
bearing, tidings, in, sanctuary
showed, mercy than Lollipop,,
kissed, him, to, Prince
dodge, weapon, upon, shoulder
make, which, for, part
see, floor of cloud, in, verandah
holding, hand, on, top of head
snatched, slipper, as, usual
brought, cry of delight, from, Teeka
saluting, him,,
Have, drink,,
finished off, cake, to, work
signs, himself, to, us
Got, one,,
wash, feet,,
inform, us, at, time
bearing, offerings, in, streets
has, effrontery, upon, absurdity
beat, music like waves, with, light
read, that, with, tutor
wear, one, to, -night
weave, way, to, bar
drew up, himself, from, road
committed, which, at, phrase
seen, that, like, Day of Judgment
have, mind, for, egotism
slipped on, gloves,,
seen, body, over, her
changed, gods, at, times
went, mist, at, midday
have, name, In, Nomansland
frôler, ankles, round, feet
dropped, it, on, day
abased, myself, before, her
inflict, punishment, for, boredom
appropriated, seat,,
put on, shoes, for, you
followed, him, at, him
touched, me, with, sceptre
tore, her, for, nights
control, us, for, time
startled, student, about, gods
have, onions,,
send, futurecompositionof like character, to, Drum
bring, message, from, shores of Nile
stroked, her, with, pleasure
trouble, myself, about, you
know, fact,,
detecting, smell of burning, upon, time
procure, water, In, meanwhile
Send, it, to, them
tell, you,,
know, it,,
Let, me,,
added, handful of dates, to, store
accomplished, embassy,,
manage, it, to, herself
left, lungs, in, rush
illustrated, pages of Dictionary,,
made, end, of, me
added, jewel, From, beginning of beginning
asked, cause, for, excursion
sending, presents, by, carrier
gained, point of view, In, minutes
followed, him,,
puttingthemin, possibleminion, upon, them
behoves, each,,
lay, hands, upon, skin
raised, it, in-, waiting
spared, pains,,
took up, key, against, roof of hall
visited, temples, to, councils of priests
flatten, signs of discontent, than, Loo-chow
considered, manner,,
deepened, colour of patches, by, slips of land on places
studying, Reggie, for, interval
gave, lecture of hour, with, whipping
neglect, altars, save, remnant
called in, minister, to, him
hear, streams, into, valleys
got, kick, beyond, doubt
took, pinch of snuff, of, act of idolatry
got, goods, For, reason
attend, goings,,
hung, masses of cloud, along, ridges of hills to right points
put, muscles, to, trial of strength with ape
faced, monster, in, fear
know, her, of, Greeks
Stop, moment,,
sprang, circle of columns, From, verge of second
set, face, as, one
gave, caution,,
shedding, gallons of tears, down, hall
heard, crow, in, silence
Let, boy,,
makes, mock of thee, from, sea
took, heart, on, covers of magazines
takes down, word, by, hand of Ming
appeared, spot of blue, at, moment
Sending away, women, in, excuse
heard, pattering of feet, After, time
took, risks, at, nothing
cutting, arabesques, From, mouths of dragon from eyes from breasts from horns
opens, mouth, in, strife
placed, stanzas on Bob by editor, before, eyes
learned, All of this, from, lips
had, respect for clergyman, to, Rev
meant, what, in, instant
had, difficulty, With, verse
kiss, him, to, room
smite, them, upon, Egyptians
close, eyes,,
numbering, those, upon, tables
know, it, for, him
teach, thee,,
open, them,,
looked out, rhymes to Bob,,
called, herself, As, Godmother
do, injury, of, reach of antagonist
resume, journey, With, warning
bore, candles, like, torches
hurling, billingsgate, like, bull
tell, one, from, other
quiet, moans, of, nursery
kept, her,,
facing, other, for, breath
discovered, door, in, yard
had, bevy of tapers, with, petticoats of lustres
fumbled, ball,,
have, fund of sense, At, time
let, eyes, during, pause such this
has, thing, in, Review
uttering, words of power, before, it
ask, help, of, one
wishes, you,,
took up, fan,,
see, sense of it, As, cant about effort
spoke, words,,
saw, roofs of Palace, beneath, feet
exasperated, other, in, ways
left, countenance, by, expression of fear
forced, feet, for, Kai
reach, ears, from, grounds
send, it, to, Fly
recognized, that, With, cry
had, fans, between, fountain
question, him,,
shut out, view, To, delight
stretched, gardens, Beyond, escalier
Let, me,,
Restrain, greetings, in, midst of obeisance
entered, brain, from, year to year
dreaded, jealousy of editor, for, contributions
passed, way,,
flashing, what, in, sun
consigned, article, after, deliberation
dandle, him, to, him
marks, end of Allthetime, to, land beyond river
lost, way, through, night of years
heard, summons,,
doffed, suit,,
shading, eyes, with, hand
had, satisfaction, In, number
carved, chiefs for Sally, from, ports
call, attention of readers, to, stanza on Oil
leaped, Sheeta, in, terror
serve, thee,,
say, nothing of sublimity, without, tears
shape, tongue, to, point
kicked out, them, after, day of christening
know, sorts of things, in, ringlets
lifting, spell, of, gods
telling, Coachman, about, it
had, look to them,,
boasted, dresses, As, rest of company
knows, little,,
know, works,,
reached, trees, of, him
took, stool,,
wanted, what, for, son
climb, stairs in tower, after, that
know, things,,
givest, wages of sin, with, desires
make, face,,
