orders, malefactor, to, covett
made, me, in, provisions
attacked, him,,
unroll, parchment, at, scroll
gathered, handful of leaves, to, end of branch
have, something,,
told, her, from, tower
thought, more, of, sin
show, much, at, time
take, it,,
desired, which,,
tell, him, in, casket
had, which, with, admonition
annihilate, men,,
gave, pleasure, between, me
made, meals, of, kinds
Wrap up, it, in, paper
cried, Professor, with, cloud318 of dust
cast away, That, to, me
mocked, him, on, snow
improved, fishery, to, family
pursuing, quest, through, scuttle
suggested, name, at, last
comes, country, with, you
follow, him, in, conflict
doubled, dimensions of it, Upon, this
brush, myself,,
did, what, on, tiptoe
left, home,,
set out, which, By, time
had, mind, at, mouth of rill
combat, fraternity, in, city
find, Math, at, stage of being
have, dreams, in, cold
troubled, her, from, room
interpret, them, with, whims
Thank, you,,
touch, them, at, fowls
gathered up, -thirds of net, by, time
seeing, few,,
lost, prominence,,
felt, springs, in, blood
covered, eyes, with, hand
begged, them,,
imagine, part, at, time
surveyed, structure,,
figured, Bel-Imperia, in, affairs
put on, it, by, mistake
set, store, with, her
told, her, with, shudder
told, anything of peril, after, all
put, wing, on, each of plates
sat, stick in hand, of, it
unstitched, her, in, Radegonde of tale
clapping, feet, in, rill
Let, ’s, at, platform
see, it,,
make, resistance, on, land
make, anything, of, notes about Guivret
see, guile,,
flung, doors, to, floor
desired, whom,,
come, some,,
smelt, death, to, me
survey, it, at, length
Had, Half of Everything,,
singing, song,,
let, you, into, court
tore, it, to, closet at hand
have, crullmotts,,
remember, look, into, eyes
had, fins, like, arms
seen, that, For, more
understand, thing, into, eyes
had, feet, upon, which
loved, beauty, to, them
reach, Ozpril,,
dropped, coin, into, hand
keep, that, about, house
Let, 's, into, run
have, memory of winters,,
tell, me, on, me
attack, me, to, him
set, bowl of punch, into, night
saw, Orion, of, baby
putting in, appearance, At, length
made, plane, to, bits
protect, chair, with, fall of light from sky
had, opportunity, during, time
desired, brother, in, account of reception
saw, ice-sheet,,
knew, enough, into, rooms
told, him, to, tower
undertake, job, for, money
adapted, themselves, to, conditions
Let, 's, with, them
hear, question,,
bidding, us, to, wife
kept, which, towards, me
doing, What, with, hedgehog
Observing, descent, to, landing
disappointed, everybody, at, time
worship, things of Freer,,
had, snout like boar,,
suspect, anger, for, part of conduct
took, hold, of, lip
cleave, man, to, chin
found, whom, at, Gardener
gulped, Scarecrow, into, air
surveyed, him, in, breast
propounded, plan,,
appraising, heroes of Poictesme, of, whom
took, shoes, at, them
counted, steps, to, landing
made, sounds, After, while
given, any of things, for, ought
avoided, enemies, in, caves
sniffed, business,,
let, me,,
written, which, For, rest
keep, potato,,
answered, him, with, Orion
seized, MSS., With, alacrity
giving, howl,,
gave, orders for despatch, to, utmost
tells, truth,,
see, platform,,
had, time, over, net
show, you,,
clear, thyself, of, deed
opened, bag, to, Lion
know, nothing of it, on, ring
gave, thought, to, rune
forbid, her, with, excuses
tell, me, on, me
had, steadfastness of purpose, of, us
use, words, among, persons
arrest, glance,,
possessed, things, of, which
free, hands, toward, him
need, growl,,
filled, cask,,
Raising, eyes, to, roof above him
Clothe, yourself, with, fire
determine, shape, on, platform at edge
ask, mother, of, it
explained, enmity between me,,
bring down, cart, to, land
stilling, it, without, warning
saw, boy, in, place
preserve, silence, to, that of Hermione in act
Do, everything,,
cast, robes, around, me
led, way, to, Pavilion
straining, vision, down, vista
mention, them, in, connection
gainsaid, Eric, in, matter
taken, pains, for, profit
found, gourd, with, rain
ask, consent, up, to
considering, him, As, artist
sent, express, over, Normnbdsgrsutt
deriving, pleasure, in, particular
drank, it,,
weighing, things,,
admiring, way,,
give, life,,
filled, lungs,,
see, boy, by, family
rewrite, Jurgen, Since, 1921
thought, this,,
Let, me,,
took, gourd, to, stream
doing, what,,
had, light beside that, for, while
took, delight, of, you
harm, you,,
include, all of Frank, in, edition
sang, verse, down, cheeks
listened, soul, in, ears
lose, eye, in, heart
made, bad,,
threw, gourd,,
set, palette, from, company
taken, Patty, into, service
entered, head, with, water
conceal, emotion, with, sobs
order, you,,
sound, cavern,,
let, project, In, short
faced, other, in, ring
solved, it, for, me
found, expresses from colambs, Upon, return to Arndrumnstake
loved, man, at, first
get, hold, for, him
hates, pomp, with, Youwarkee
lends, temper, by, love of art
Didhesee, Bar of Soap,,
take, woman,,
gripped, him, round, middle
face, what,,
hugging, other, like, bears
help, me,,
had, fun, with, it
Dare, we,,
lift, Eric, For, time
saw, end of it, in, manner
cheered, fields, for, beauty
find, her,,
desire, What,,
storing, water, after, this
put out, strength, of, sudden
despatch, messengers, In, meanwhile
makes, you,,
left, tower, in, heart
heard, voices, To, this
lowered, eyes, With, face
put out, foot,,
questioned, Jellia,,
deny, it,,
take, whom, To, you
knew, what, to, her
acquitted, myself, of, charge
threw, me, into, fears
recognize, Master,,
deny, it, to, world
begun, it,,
see, anything, of, window
kept, supply of -water, in, cave
conceal, love, for, other
give, account, to, Law
rule, Kingdom,,
let, buckets, through, traps in roof
received, notion of merits, at, load of praises
pacing, parquet, In, room
say, which, At, length
included, more, in, volume of bulk
given, vent, In, this
gave, thanks, on, knees amongst leaves
had, spells,,
catch, dinner of fish, As, departure on morrow
picked up, one of roses, by, foot
blessed, reflections, in, pool
heard, them, from, point of compass
make, choice of stories, into, shape of narrative
known, embrace of Spirit, from, heart
found, her, in, dark
make, him,,
asked, Professor,,
make, stories, in, romances in form
make, Popeany,,
said, everything,,
carrying, water, after, that
let out, roar, From, shock
invaded, Rome, in, cloisters
worshipping, stars, for, purpose
burst, fetters, in, upheavings of breast
ruling, chieftain, in, half of century
had, manner of knowledge, in, voyage through cavern
entered, Pavilion,,
supplicating, images,,
entertaining, myself, with, speculation
shrugged, shoulders, as, ghosts
threw, him, by, skill
put, beam, under, it
angered, you,,
supposed, 'em, for, bridge
passing, St., to, right
saw, posse of people, towards, bridge
get, what, After, meal
patting, it,,
typifying, mists, over, frontier
hide, passion, by, flight
taking, look, At, this
look, it,,
fulfil, duties, for, her
inclining, head, toward, lion
showed, farmyard, at, which
waste, strength,,
bemoaning, misfortune, to, grotto
Take, woman, at, once
Let, me,,
have, room, against, them
directed, lion, in, roar
had, due,,
had, hold, into, grip
passed, him, in, progress
carried, them,,
gave, due, of, Elfland
knew, glory, through, space
stored, water, At, first
know, one, with, berries
mérité, admiration, Par, exploits
acknowledged, her, as, kin
knew, end,,
carrying, berries, In, time
diverted, ourselves, in, wood
répondra, jamais, à, questions
realise, power, of, love
had, converse, in, place
bided, time, in, dark of casket
analysing, feelings, from, eyes
show, discontent, at, distance
forget, that,,
faite, que, à, réalité de figure
led, children, upon, platform
left, eaves, over, Erl
put out, might, round, ring
instilling, poison, into, veins of victims
informed, them, to, bridge
inclining, me, to, repose
reigned, power of Earth, in, her
inspected, him,,
forgotten, gourd, Without, doubt
supplicated, images, to, stars
divide, them,,
est, purifiée de race,,
overwhelmed, her, into, fists
knew, Youwarkee, with, sight of -folks
brought, candle,,
escape, thee,,
had, recourse, In, height of distress
entered, head, of, -withes
think over, it, for, purposes
heard, step beside her, in, silence
found, myself, on, occasions
let, us, to, themselves
told, her, on, bowl
take, him,,
informed, me, at, aunt's
snatching out, handkerchief,,
stir, other,,
tied, vines, about, bundles of ferns
find, her, to, lake
play, spy, from, us
refusing, surrender,,
told, things, With, courtesy
reminds, company, to, castle
make, play, with, youngling
stopped, me, In, passage
give, pat,,
lifted, them, to, eyes
drew up, fishes in all, at, draught
put, gist of matter,,
take up, ones, in, arms
drink, wine,,
discharged, debt, to, club—
asked, them,,
remembered, all, for, days
wove, withes, of, this
know, her, at, her
worship, stars, from, nursery
lowered, them, to, level of lips
do, -tricks,,
covering, nakedness,,
mate, me, by, strength
worship, them,,
ground, fangs, on, guile
swept, her, against, lips
seize, her, in, arms
arranged, machines, on, table
gleamed, foot of Eric, By, foot
left, her, before, hours
do, what,,
docked, boat, Upon, return
watched, them, From, corner under piano
hugged, lion, for, breath
drew out, pebbles, into, night
shouted, voices,,
play, King, from, embrace
made, haste, with, me
loaded, fish, for, legs
had, nothing but Patty, in, head
drew out, them, in, meadow
behold, spouse, in, voice of sweetness
detected, assertion as thoughts,,
produced, manuscript, with, show of reluctance
bid, them, at, it
declared, Scarecrow,,
able, whom, with, unhumanness of father
worship, stones, in, pain
choosing, her,,
have, mind for it,,
show, it,,
achieved, that, to, northeast
follow, lead, For, part
saw, anything like it, in, life
rob, me, of, lord
checked, folly, into, degree of temper
twined, legs, upon, haunches
saw, stones, to, which
can, what, by, Manuel
taking out, note-book,,
knew, this, from, observation
have, daughter, Than, whom
stepping, yards, before, them
repeated, father,,
say, that, with, addition
worship, things of Freer, with, spirit
force, head of Brighteyes, with, strength
assist, me,,
let, me,,
made, impression, on, them
heard, voices, on, sudden
asked, them, to, me
Tell, him,,
feared, that, of, things
used, which, with, anger
made, affair of it,,
warn, you, of, laboratory
supply, necessities of house, save, splashes
worship, things, to, heart
putting, arms, to, Sylvie
do, What, neath, sense of obligation
have, none, of, her
informed, you, in, room
speak, words, in, matters
beheld, scene,,
loose, thee,,
face, them,,
loosed, grip, of, sudden
have, company, about, me
teasing, tiger,,
cast, stones,,
Thenanswered, Magician, unto, thee
brought, us,,
informe, you,,
waving, kerchief, For, present
Let, Amenartas,,
got, gun, During, soliloquy
explain, operation of gun, to, you
confound, it, for, what
have, supper, in, Pavilion
had, hold,,
heard, sort of shriek,,
bade, her,,
have, diffidence, for, yourselves
tore, turf, For, while
drink, brandy, in, environs of Rathgor
brought, them, At, last
pommelled, pavement,,
heed, him,,
chattered, dislike, upon, him
saw, something in shape, to, corner of building
flung, himself, into, arms of Amenartas
Count, me, of, that
watched, which, with, child
gave, word,,
held, him, around, him
had, way, with, girls
making, row, from, branch to branch
eat, bite,,
hugged, him, with, rage
say, nothing, into, it
threw out, will,,
spoiled, hunting, for, him
laughed, Sylvie,,
Shunning, youth, at, bidding
made, which, over, nothing
make, it, for, wisdom
made, him,,
Saying, nothing, upon, him
say, it,,
force, way, through, side
becomeThe, minion,,
knowing, him,,
kissed, boy, before, sunset
reply, child, nto, face
gainsay, this, with, modesty
had, pleasure, with, fare
said, All,,
supporting, cross of wood, upon, margin of pool
made, supper, over, adventures
pelted, him, with, twigs
made, her, from, coffer
felt, pity for her, in, fire
shifted, grip,,
fetched, lamp, At, length
viewing, parts, from, face
took, breakfast, after, which
drew, eyes, to, words in characters
bade, him, upon, face
felt, jar of tread, in, study
find, him,,
embraced, me, for, departure
cried, Professor,,
find, us,,
gone, way of belly,,
had, that, in, rune
means, table,,
Crushing, heartThat, from, ruin
told, you,,
put, it, With, heart
shut up, note-book,,
see, loves,,
taught, animals, by, ordeals of helplessness
have, need of guidance,,
spare, rival,,
scowling, monocle, of, eye
fetching, flageolet, to, Rosig
tell, you, in, pool
read, rune on scroll, over, border
drew, him, with, strength
speak, ill, against, oneirologya
reached, him, to, Eric
cursed, us,,
leave, clerk in City, at, once
seeing, it, with, holes in it
saw, man, at, him
served, lordship,,
receive, soul, to, Isis
know, them, after, death
given, him,,
put, tail, Toward, last
did, best, with, him
told, him, into, use of it
held down, her, upon, floor
prompted, us, across, ground
hear, me, of, safety
snatched, sword, from, belt
had, power,,
re-entered, grotto, of, thoughts
guard, him, round, Eric
set, lamp, for, fear
hurried, children, into, Saloon
Down, swords, from, snow
Expects, wife, for, reception
saw, things, in, water
had, idea,,
model, it, at, all
remember, Rodriguez,,
take out, such, into, chests
reached, her, to, her
dismissing, triplets, with, wave of eyeglass
heard, voice, from, breast
see, us, for, time
containing, cake, in, corner of Saloon
make, figure, in, world
see, What, in, ear of Gudruda
have, man, at, Eric
make, room, of, furniture
see, what, as, afterthought
bethought, me, Upon, this
told, him, up, steps to Pavilion
left, them,,
tried, some of them, in, chests
offer, bezants in gold, for, dead
kissed, Eric, on, brow
heard, her, in, respect
taking out, book, with, us
examining, contents of chest,,
afforded, which, by, light
punished, them,,
closed, book, with, exclamation of admiration
let, fire,,
make, figure of man, upon, me
noticed, jars, around, room
asked, questions, to, her
mentioned, geas,,
beckoned out, her, by, stream
made, dash, at, me
laid, them, in, mind
cherished, her, with, careI
prophesy, This, of, thee
call, bond,,
took, places,,
notice, machine,,
see, her,,
grieved, me,,
adjure, you, By, blood of yours
deliberated, question, from, figure
lift, her, off, bed
knew, place, into, lair
dance, her, on, kneeTo
greased, shoes,,
consider, preparations, for, party
saying, more, than, that
conjure, wife, With, words
having, head, to, shoulder
knew, What, nightOf, storm
overthrow, thee, of, men
Take, sword,,
took, snow, from, brow
IBeguile, night, throughout, chamber
took, her, in, arms
reject, gifts, to, me
shook, head,,
touch, it,,
grabbed, him,,
grasped, Whitefire, from, scabbard
tell, you,,
seek, peace,,
wheeled, it, round, head
thought, this,,
having, obligation, upon, head
giving, reins, to, tongueThat
promise, this, in, marriage
wear, beard,,
avoided, lamp, toward, it
fare, you, for, ever
humoring, mother, at, you
divorcing, me, to, me
hear, her, than, words
grabbed, puppy, by, tail
possessed, me, of, rage
got, teeth, into, me
took, turn, to, another
offers, wealth, by, magician
took up, implements, on, this
say, This, in, year
call down, death, upon, thee
have, occasion, than, ever
took, hand, in, eyes
saw, her, in, attitude
donned, sword, in, scabbard of leather
waste, energy of mass,,
set, best of everything, before, her
kept, instrument, in, there
caution, you,,
gave, some of cordials, After, supper
applauded, Scarecrow,,
found, him, for, standard
bowed, head,,
see, Mountains, over, horizons
tied, balloons, to, one of pillars
pleased, him, to, which
showed, bed, to, it
heard, words,,
rescue, Count, of, daughter
made, animals, with, young
called, himself, than, Pope's
saw, other, of, chair
made, matter, at, length
tell, me, to, him
spoke, words of doom, in, madness
treated, her, for, time
had, message,,
sufficed, him, in, garden of Bucoleon
put, three of cushions, Instead, one
know, meaning, to, both of us
ask, thee, before, men
striving, all, with, her
showed, disquiet at confinement,,
saw, house of worker, for, sword
fulfilled, themselves, into, face
set, tent, on, fire
Onemightexcuse, omissions, over, chair
saw, line of them, for, Mountains
contrives, manner of illusions, in, splendor
finished, soliloquy, in, air
entered, house,,
losing, mistress,,
collected, brethren, in, Temple
took, boat, as, usual
made, that, of, majesty
mind, nap,,
liked, that, than, fresh
greeted, Alveric, for, wife
bore, fruit, by, noon
making, some, of, it
swear, troth of thine, in, pledge of them
possessing, flesh, upon, feet
renew, search, in, day
spent, remainder of winter, in, middle of them
made, work, of, her
touched, pillows, Without, urging from Jellia
taking, Whitefire, in, hand
had, chance,,
rescue, daughter,,
teach, her, in, youth
felt, flight of years, to, Elfland
strengthened, remark, After, thought
won, shame, from, fight
suit, me, at, all
tell, me,,
set up, empires of dwindle, in, treasury
lifted, eyes, to, parent
rescues, Lady, to, champion
filled, heart, to, feet
seeing, us, By, time
took, it, for, silk
said, things of loss,,
making, signs, before, me
addressing, Society, in, general
struck, dread, into, me
take, sword,,
needs, rest,,
seen, them, over, face
disobeyed, you,,
Hear, hear,,
HeAsked, me, at, convent
asked, them, with, father
crave, that,,
demolished, figure, on, scabbard
Get, thee, in, quarter
sheathed, Flamberge, to, pigs
drove, him, with, speed
return, pigs, to, you
asked, noise, over, rock
cross, it,,
have, laugh,,
have, adversary, to, himself
answered, it,,
shot, glance, at, him
hold, men of account, in, south
offered, food, of, Elfland
heard, gripsack, with, them
gave, poke, to, throne
began, one of tasks,,
remembered, which, to, field
saw, thee, With, eyes
do, something,,
had, her, in, manner
gave, comfort,,
see, him, About, hour
had, hand,,
saw, toadstools, to, field
asked, me, under, jacket
shook, head, against, cushions
tell, Prince of India, After, expression of sympathy
carry, puppies, to, cave
prepared, provisions of fowl, in, time
did, thing,,
confide, secret, to, thee
come, pigs, to, you
put, people, at, ease
using, hands, for, climbing
beg, you,,
gone, pigs, after, that
keep, secret,,
spoke, English, in, English
heard, murmur of waves, By, this
took, work, off, hands
had, confidant,,
have, anything, at, all
did, what, For, rest
saying, bye, to, whom
trust, me, With, statement
find, life, Since, then
bid, farewell, to, Suskind
inquired, Jellia,,
find, something,,
crossed, field, as, field
seen, colour of gold,,
settles, formality of reception, to, grotto
Breaking off, vines, around, neck
make, jokes aboutme,,
opening, eyes, in, pocket
left, him, with, hands
wed, maid of thine,,
wear, coat, of, jacket-sleeve
tying, legs,,
are, that, without, flowers
fill up, you,,
heard, them, in, order
tell, thee, from, arms
imagine, way, for, heart
cursing, me, by, gods
think, thou,,
had, business,,
saying, that, in, Poictesme
Holding up, it, to, light
calling, evil, upon, head
communicated, This, to, father
hear, it,,
raise, ideas,,
addressed, them, to, crowd
Learn, A’s,,
touch, it,,
use, magic, on, me
pardon, me, in, which
sink, teeth, into, stomach
furnish, you,,
interpret, it, for, me
spoil, happiness,,
mounting, height, with, sound of voices
cried, farewell to stranger, to, devices
knew, nothing of dress, for, wig
do, that, with, weapon
saw, murder, for, both of us
doubt, you,,
admit, you, in, it
embraced, Youwarkee, during, which
beginning, ascent, under, maple-trees
balancing, tray, up, steps
brightens, much, of, lives
tell, you, for, crimes
clothe, himself, on, heel
doing, whatever, in, place
shook, head,,
met, Groa, On, threshold of door
have, desire, on, Kallikrates
whispered, Youwarkee, of, relations
said, Whatwas,,
abused, hyena, through, trees
put, tray, on, table
have, what,,
saluted, her, to, hand
seeing, her, upon, me
put, grease, upon, shoes
follow, me, down, cave
lying, toy, on, ground
fanned, herself, in, way
make, it,,
made, work, on, idea
perceiving, loveliness, in, light
saw, it,,
repay, thee, for, this
emitted, sound, at, space
bite, you,,
have, wealth, on, knee
Bless, me, over, rock
saw, things, with, romance
roared, Lion, like, hare
got, aspark,,
sent, saucers of pudding, Without, enthusiasm
asked, pardon, to, wife
take, heed, to, meat
wish, luck,,
fancied, that, for, Earth
had, pertinacity than Folk,,
touch, it,,
slain, himself, to, wound in breast
left, room, by, cooks
wed, Asmund, among, Finns
pass over, it,,
waved, hands, to, feet
forget, age, at, puberty
get, things, to, Bruno
gave, each of them,,
slew, him,,
put, restlessness, at, last
warned, Soldier with Whiskers, off, throne
allow, him, with, me
done, what,,
lifted, Kallikrates, at, command
make, you,,
ate, last of food, through, greyness
know, this, for, carline
startle, people, on, backs
bore, Kallikrates, through, caves
make, things, of, boat
carrying, something, in, procession
matter, what,,
having, any,,
promise, you, for, fear
says, Manuel,,
crossed, room, in, gown
bit, me, with, him
say, what, to, end of witches
shook, head, with, Wantowin
induced, pup, in, love
bade, Syama, with, promptitude
tell, you, about, that
had, woman in arkoe, but, daughter
bade, thee, to, convent
done, what,,
like, things,,
put, me, in, fear
know, method of speech with him,,
lapped up, saucers,,
knew, that, at, Middalhof
have, title, to, you
set, it, before, her
refused, fruits, for, him
told, him, to, father
found, myself, at, side
catching, game,,
greeted, him, as, one
put, spy-glass, to, eye
saw, sign of Elfland, at, last
drew, sword, from, sheath
invented, it, with, it
assured, me, To, this
killed, puppy, to, cave
kissed, hand,,
told, all,,
had, management of affairs, for, yourself
see, child,,
bit, me, upon, me
watching, him,,
had, power against enchantment, for, all
told, you, of, room
clapped, hands, to, attendants
dreamsDisturbed, slumber, of, rest
understood, trouble,,
lost, Elfland, For, while
call, what, in, passing of years
ask, you,,
deemed, them, By, dressI
made, bow, on, table
bore, Kallikrates, down, spur
amuse, boy, In, days
knew, her, In, short
hung up, sign, on, door
have, notion,,
had, thingsRevealed, to, them
smoked out, her,,
lifted up, corpse of Kallikrates, to, chamber
pursuing, lion, with, arms
pulled, hair, in, handfuls
frame, notion of it, at, boat
bid, her, into, mind
save, you,,
bring, number of people, for, guards
snatching, cord, from, pull
bring, Unna,,
put, hand, over, mouth
shown, marks of distinction, to, whom
said, word of thing, with, which
take, wife, For, cause
take in, her, At, last
ate, puppy, After, that
erected, tent, with, ease
Have, suggestion,,
W-, what,,
leave, it, At, events
paddling, legs, like, dog
fear, Groa, between, us
put off, costume,,
procured, water, to, dock
Take, blessing, from, harm
find, what, for, marvels
gave, look, of, admiration
bid, her, to, -morrow
take, it,,
shaken, him, at, Middalhof
shouted, father,,
call, him,,
excite, attention,,
asked, Ziroonderel, at, last
has, things, from, place
had, words with Gudruda,,
took up, spoon, to, body of Kallikrates
pledged, fealty,,
told, him, in, words
feared, question, in, mind
using, force, into, boat
hold back, flesh, from, fingers of decay
saw, Swanhild,,
pray, you,,
wants, what,,
had, it, upon, now
see, villagers, in, walks with Ziroonderel through hamlet
receive, reward,,
let, me,,
opened, receiver, near, machine
put, it, into, mouth
kiss, hands,,
require, breath,,
brought, her, at, it
cross, grass, by, well
brought, two of sticks,,
regarded, him, in, fury
told, her,,
lit, fire, outside, chamber
reached, bones of those, before, them
remembering, things, over, face
placed, leaves of shrub in shape, In, pot
made, run, by, lake
becoming, men,,
help, it,,
took, spoonful,,
understands, me,,
love, him, at, all
followed, him, on, horse
tell, me,,
saying, deal, in, day
reached, step of Pavilion, by, time
had, spinach, by, time
Believe, fish, than, masters
tell, tales of manner, to, Orion
brought, funnel of clay, with, point
beat, wives,,
stood, corpse, on, feet
stumble, steed,,
bethought, him, Since, matter of greasing
Let, me,,
meet, person, with, whom
set, ladder, against, wall
prevented, my,,
brought, sticks,,
saw, Oth, in, evenings with threat
told, What, by, road
finished, work, in, way
accosting, me, with, smile
gainsaying, him,,
explained, Hippenscop, with, pride
hated, her, with, spite
deemed, himself, to, Threl
follow, her, to, edge of lake
Show, woods, to, him
brought, bowl of punch, After, dinner
asked, her, in, marriage of Eric
have, visions of hour,,
help, it,,
hold, him, beyond, lip of valley
have, daughters, with, machine
having, friends, in, years
replies, Manuel,,
obliging, us, to, me
led, him, at, Ziroonderel
went, ways,,
plighted, troth,,
Help, me, to, dowhat
asked, them,,
seen, her,,
returned, thanks,,
keeping, finger, for, moment
had, power, to, which
expect, what,,
know, me,,
have, it,,
put, you, to, inconvenience
found, her, In, hall
have, adversary,,
paint, dog,,
multiplying, numbers, in, year
break, egg, To, contrary
have, speech with me, in, court of temple
have, it,,
told, him, for, fish
got, people,,
wiz, itsmouf,,
had, time for reflection, in, minutes
Know, thou,,
recovering, Lael,,
bade, him, for, fun
blow away, you,,
Give, egg, to, destruction
tell, him, in, love
breaks, screaming, from, cave
conducted, him, with, punch
told, tale, in, ears of priests
called up, spirit of roving, to, woods
find, myself, with, Youwarkee
do, this, at, last
gasped, Jellia, in, voice
bandaged, eyes of horse, in, place
lose, her,,
let, him, in, end
clasping, her, to, myself
murdered, lord, to, them
hold, him,,
beating, wife,,
see, Unna,,
exhibit, Specimens, After, that
say, Don, spite, years
make, you,,
called, glamour of woods, of, wand
keep, you, at, her
explain, Process,,
everPassed, lips,,
has, way,,
heard, him,,
make, figure than they, by, knowledge of things
accept, that, without, contradiction
believe, Majesty,,
fingered, them, to, house of Oth through garden
saw, me, with, arms
